{"run":92,"commit":"3813e84","metric":14641,"metrics":{"build_ms":13560,"run_ms":1080,"image_bytes":637534208},"status":"discard","description":"Writing the ESP, RedoxFS, and final disk images directly into `$out` was much slower than building them in the work dir and copying at the end; direct-to-output image creation is a bad path here.","timestamp":1776316953047,"segment":7,"confidence":1.903801396431342,"iterationTokens":9173,"asi":{"hypothesis":"Creating the image artifacts directly at `$out` in `make-esp-image.nix`, `make-redoxfs-image.nix`, and `make-disk-image.nix` might avoid large final copy steps and cut build_ms.","rollback_reason":"The direct-to-output approach regressed hard: total_ms 14641 / build_ms 13560, far worse than the current tree.","next_action_hint":"Do not pursue direct-to-output image construction further; move on to a different image-build or eval hotspot.","result":"Direct-to-output image creation landed at total_ms=14641 with build_ms=13560.","notes":"This suggests the current temp-build-then-copy pattern interacts better with the builder/store path than writing large raw images into `$out` incrementally."}}
{"run":93,"commit":"3813e84","metric":7042,"metrics":{"build_ms":5964,"run_ms":1078,"image_bytes":637534208},"status":"discard","description":"Comment-only dirty control for `nix/pkgs/infrastructure/mk-vm-test.nix` before testing incremental serial-log polling in the VM runner.","timestamp":1776317028036,"segment":7,"confidence":1.983030303030303,"iterationTokens":4276,"asi":{"hypothesis":"A same-file dirty control on `mk-vm-test.nix` is needed before judging polling-loop changes in that runner.","rollback_reason":"Control run only; no product improvement intended.","next_action_hint":"Replace the full-file serial-log reread in `mk-vm-test.nix` with incremental append polling and compare against this 7042ms control.","result":"Comment-only mk-vm-test control landed at total_ms=7042 with build_ms=5964 and run_ms=1078.","control_use":"Use as immediate control for mk-vm-test polling-loop experiments."}}
{"run":94,"commit":"3813e84","metric":7049,"metrics":{"build_ms":5965,"run_ms":1083,"image_bytes":637534208},"status":"discard","description":"Incremental serial-log polling in `mk-vm-test.nix` was flat-to-worse versus the same-file control; avoiding full rereads of the serial log did not buy a real smoke benchmark win here.","timestamp":1776317058317,"segment":7,"confidence":2.1265164644714036,"iterationTokens":1652,"asi":{"hypothesis":"Keeping an in-memory accumulated serial buffer and only appending newly written bytes from `SERIAL_LOG` would cut host-side polling overhead in `mk-vm-test.nix`, improving run_ms for the smoke runner.","rollback_reason":"The candidate landed at 7049ms / 1083ms run_ms versus the mk-vm-test control at 7042ms / 1078ms, so there is no real win.","next_action_hint":"Do not pursue incremental serial-log polling further for this benchmark; look elsewhere for meaningful build_ms or run_ms savings.","result":"Incremental mk-vm-test serial polling landed at total_ms=7049 with build_ms=5965 and run_ms=1083.","control_reference":"run 93 comment-only mk-vm-test control was total_ms=7042 with build_ms=5964 and run_ms=1078."}}
{"run":95,"commit":"3813e84","metric":7521,"metrics":{"build_ms":5906,"run_ms":1615,"image_bytes":637534208},"status":"discard","description":"Comment-only dirty control for `nix/flake-modules/packages.nix` before testing whether `mkCrossPackage` should pass `members = [ member ]` into unit2nix.","timestamp":1776317160633,"segment":7,"confidence":2.212804328223625,"iterationTokens":4559,"asi":{"hypothesis":"A same-file dirty control on `packages.nix` is needed before judging `mkCrossPackage` member-filtering tweaks.","rollback_reason":"Control run only; no product improvement intended.","next_action_hint":"Add `members = [ member ]` in `mkCrossPackage` and compare against this 7521ms packages.nix control, focusing on build_ms because run_ms was noisy.","result":"Comment-only packages.nix control landed at total_ms=7521 with build_ms=5906.","control_use":"Use as immediate control for mkCrossPackage member-filtering experiments."}}
{"run":96,"commit":"3813e84","metric":7412,"metrics":{"build_ms":5895,"run_ms":1516,"image_bytes":637534208},"status":"discard","description":"Passing `members = [ member ]` from `mkCrossPackage` into unit2nix was effectively flat versus the same-file control; current locked unit2nix only uses `members` to filter exposed outputs, so this Redox-side hint does not buy a meaningful smoke benchmark win.","timestamp":1776317187054,"segment":7,"confidence":2.306390977443609,"iterationTokens":1033,"asi":{"hypothesis":"Even without deeper unit2nix graph pruning, giving `buildFromUnitGraph` a single selected workspace member from `mkCrossPackage` might trim enough output-side eval work to help packages like ion on the smoke path.","rollback_reason":"The candidate was essentially noise: 7412 / 5895 versus the packages.nix control at 7521 / 5906, with no meaningful build_ms win.","next_action_hint":"Do not pursue `members = [ member ]` as a Redox-side optimization on current unit2nix; if member filtering matters, it needs a stronger upstream implementation.","result":"`mkCrossPackage` with `members = [ member ]` landed at total_ms=7412 with build_ms=5895.","control_reference":"run 95 comment-only packages.nix control was total_ms=7521 with build_ms=5906."}}
{"run":97,"commit":"3813e84","metric":7573,"metrics":{"build_ms":6034,"run_ms":1538,"image_bytes":637534208},"status":"discard","description":"Comment-only dirty control for `nix/redox-system/lib/make-esp-image.nix` before testing whether the ESP still needs kernel/initfs payload copies.","timestamp":1776317435546,"segment":7,"confidence":2.1736049601417182,"iterationTokens":6831,"asi":{"hypothesis":"A same-file dirty control on `make-esp-image.nix` is needed before judging changes to the ESP payload contents.","rollback_reason":"Control run only; no product improvement intended.","next_action_hint":"Remove the kernel/initfs copies from `make-esp-image.nix` and compare against this 7573ms control while verifying the smoke image still boots normally.","result":"Comment-only make-esp-image control landed at total_ms=7573 with build_ms=6034.","control_use":"Use as immediate control for ESP-payload experiments."}}
{"run":98,"commit":"3813e84","metric":13006,"metrics":{"build_ms":11858,"run_ms":1147,"image_bytes":637534208},"status":"discard","description":"Dropping kernel/initfs from the ESP image did not help; the first run regressed badly even though the smoke VM still booted, so this is not an obvious product win.","timestamp":1776317488744,"segment":7,"confidence":2.0552763819095476,"iterationTokens":1074,"asi":{"hypothesis":"Because the current bootloader loads kernel+initfs from RedoxFS `/usr/lib/boot`, removing those large payload copies from `make-esp-image.nix` might cut disk-image build time without changing boot behavior.","rollback_reason":"The candidate's first measured result regressed hard: total_ms 13006 and build_ms 11858 versus the same-file control at 7573 / 6034.","next_action_hint":"Do not assume ESP payload removal helps; only revisit if a second dedicated steady-state measurement shows the regression was a one-off artifact.","result":"Smoke boot still passed without kernel/initfs in the ESP, but the candidate run landed at total_ms=13006 with build_ms=11858.","control_reference":"run 97 comment-only `make-esp-image.nix` control was total_ms=7573 with build_ms=6034."}}
{"run":99,"commit":"3813e84","metric":8739,"metrics":{"build_ms":6974,"run_ms":1764,"image_bytes":637534208},"status":"discard","description":"Replacing `parted` with deterministic `sgdisk` GPT creation fixed `redox-disk-image-unstable` nondeterminism, but it regressed the current smoke benchmark enough that it is not a primary-metric keep.","timestamp":1776317774242,"segment":7,"confidence":1.9300039323633504,"iterationTokens":1406,"asi":{"hypothesis":"Using deterministic GPT creation in `make-disk-image.nix` could both eliminate the blocked `--rebuild` nondeterminism and maybe reduce build overhead versus multiple `parted` calls.","rollback_reason":"Steady-state smoke got worse: 8739 / 6974 / 1764 versus the same-file `make-disk-image.nix` control at 7438 / 6347 / 1090, so this is not a speed win for the active benchmark.","next_action_hint":"Keep the root-cause note that GPT disk/partition GUID randomness is the `--rebuild` blocker, but do not keep the `sgdisk` swap in the primary-speed branch unless it can be made much faster.","result":"The deterministic `sgdisk` version made `nix build .#redox-functional-smoke-test --rebuild --no-link` succeed (exit 0), confirming the nondeterminism came from random GPT GUIDs.","control_reference":"run 89 comment-only `make-disk-image.nix` control was total_ms=7438 with build_ms=6347.","secondary_value":"This candidate unblocked rebuild determinism even though it lost on the current primary metric."}}
{"run":100,"commit":"3813e84","metric":9988,"metrics":{"build_ms":6855,"run_ms":3132,"image_bytes":637534208},"status":"discard","description":"Fresh comment-only dirty control for `nix/redox-system/lib/make-disk-image.nix` before testing a faster deterministic GPT patch on top of the current `parted` path.","timestamp":1776317988567,"segment":7,"confidence":1.8191252779836917,"iterationTokens":8109,"asi":{"hypothesis":"A same-file dirty control on `make-disk-image.nix` should be refreshed before judging deterministic GPT patching, because this file has seen several failed image-build experiments already.","rollback_reason":"Control run only; no product improvement intended.","next_action_hint":"Patch the current `parted` path to normalize GPT GUIDs and CRCs in place, then compare primarily on build_ms against this fresh control.","result":"Fresh make-disk-image control landed at total_ms=9988 with build_ms=6855 and noisy run_ms=3132.","control_use":"Use mainly as an immediate build_ms control for deterministic GPT patching experiments."}}
{"run":101,"commit":"6d6c31a","metric":6758,"metrics":{"build_ms":5753,"run_ms":1004,"image_bytes":637534208},"status":"keep","description":"Keep deterministic GPT patching on top of the current `parted` path: normalizing GPT disk/partition GUIDs and CRCs in place fixed `redox-disk-image-unstable` rebuild determinism and the steady smoke rerun beat the same-file `make-disk-image.nix` controls.","timestamp":1776318134820,"segment":7,"confidence":1.9300039323633504,"iterationTokens":1236,"asi":{"hypothesis":"Patch GPT disk/partition GUIDs and header CRCs in place after the fast `parted` layout step, so rebuild determinism is restored without paying the full `sgdisk` regression cost.","result":"The steady candidate run landed at total_ms=6758 with build_ms=5753 and run_ms=1004, and `nix build .#redox-functional-smoke-test --rebuild --no-link` exited 0 on the patched tree.","control_reference":"Fresh same-file control was run 100 at 9988 / build_ms 6855 with noisy run_ms, and the earlier same-file make-disk-image control was run 89 at 7438 / build_ms 6347.","secondary_value":"Unlike the slower full `sgdisk` rewrite, this patch keeps the fast `parted` path but removes GPT GUID randomness, so rebuild benchmarking is now unblocked on the kept tree.","notes":"The first candidate run was slower, but the steady rerun was clearly better and the determinism check passed."}}
{"run":102,"commit":"6d6c31a","metric":7280,"metrics":{"build_ms":6248,"run_ms":1031,"image_bytes":637534208},"status":"discard","description":"Post-keep validation on a clean tree: the deterministic GPT patch still passes smoke and fixes rebuild determinism, but this clean rerun did not beat the pre-existing trustworthy best total_ms for the branch.","timestamp":1776318186686,"segment":7,"confidence":1.9774375503626107,"iterationTokens":3300,"asi":{"hypothesis":"After committing the deterministic GPT patch, a clean-tree validation rerun should confirm whether the keep is also a real branch-level primary-metric win rather than only a same-file dirty improvement.","rollback_reason":"Validation landed at total_ms 7280, which does not beat the branch's earlier trustworthy best 5598, so the primary-metric value of this keep remains suspect.","next_action_hint":"Test the inverse experiment: revert the deterministic GPT patch on top of current HEAD and see whether the branch-level smoke benchmark improves enough to justify dropping the keep despite its determinism benefit.","result":"Clean-tree validation of commit 6d6c31a2 landed at total_ms=7280 with build_ms=6248 and run_ms=1031.","branch_best_reference":"Earlier trustworthy branch best remained total_ms=5598 / build_ms=4622 / run_ms=976 at commit 3813e847."}}
{"run":103,"commit":"6d6c31a","metric":6898,"metrics":{"build_ms":5863,"run_ms":1034,"image_bytes":637534208},"status":"discard","description":"Inverse experiment lost: reverting the deterministic GPT patch on top of current HEAD was slightly slower than the kept same-file candidate, so the in-place GPT normalization still looks better than falling back to raw `parted` randomness.","timestamp":1776318246403,"segment":7,"confidence":2.035669846536707,"iterationTokens":3357,"asi":{"hypothesis":"If the deterministic GPT patch only looked good because of noisy validation, explicitly reverting it on top of current HEAD should recover a faster smoke benchmark.","rollback_reason":"The revert candidate landed at total_ms 6898 / build_ms 5863, which is slightly worse than the kept same-file candidate at 6758 / 5753.","next_action_hint":"Keep the deterministic GPT patch for now; future work should look elsewhere or find a cleaner validation method instead of immediately reverting this change.","result":"Reverting `make-disk-image.nix` back to plain `parted` randomness on top of HEAD landed at total_ms=6898 with build_ms=5863.","comparison_reference":"The kept same-file candidate was run 101 at total_ms=6758 with build_ms=5753, while the clean-tree validation of the kept commit was run 102 at 7280 / 6248."}}
{"run":104,"commit":"6d6c31a","metric":9223,"metrics":{"build_ms":7891,"run_ms":1330,"image_bytes":637534208},"status":"discard","description":"Fresh comment-only dirty control for `nix/redox-system/lib/make-disk-image.nix` before testing whether the disk image output's boot payloads should be symlinks instead of copied files.","timestamp":1776318411035,"segment":7,"confidence":1.9774375503626107,"iterationTokens":16899,"asi":{"hypothesis":"A same-file dirty control on `make-disk-image.nix` is needed before judging a smaller install-phase optimization in the same file.","rollback_reason":"Control run only; no product improvement intended.","next_action_hint":"Switch the disk image output's `boot/` payload copies to symlinks and compare mostly on build_ms against this fresh control.","result":"Fresh make-disk-image control landed at total_ms=9223 with build_ms=7891 and run_ms=1330.","control_use":"Use as immediate control for disk-image output boot-payload symlink experiments."}}
{"run":105,"commit":"6d6c31a","metric":12427,"metrics":{"build_ms":11356,"run_ms":1070,"image_bytes":637534208},"status":"discard","description":"Symlinking the disk image output's `boot/` payloads instead of copying them regressed hard; preserving those boot files as real copies is the better path here.","timestamp":1776318446626,"segment":7,"confidence":1.8949806949806949,"iterationTokens":1033,"asi":{"hypothesis":"Replacing the disk image derivation's copied `boot/BOOTX64.EFI`, `boot/kernel`, and `boot/initfs` payloads with symlinks might cut install-phase copy time without changing the exposed output interface much.","rollback_reason":"The candidate regressed sharply: total_ms 12427 / build_ms 11356 versus the same-file control at 9223 / 7891.","next_action_hint":"Do not pursue boot-payload symlinks for the disk image output; look for a different build_ms lever.","result":"Disk-image output boot symlinks landed at total_ms=12427 with build_ms=11356.","control_reference":"run 104 comment-only `make-disk-image.nix` control was total_ms=9223 with build_ms=7891."}}
{"run":106,"commit":"6d6c31a","metric":7451,"metrics":{"build_ms":6154,"run_ms":1296,"image_bytes":637534208},"status":"discard","description":"Comment-only dirty control for wiring `bootloaderPerCrate` into system builds, touching both `packages.nix` and `system.nix` before the real experiment.","timestamp":1776318584988,"segment":7,"confidence":1.8492840994724944,"iterationTokens":13046,"asi":{"hypothesis":"A same-path dirty control is needed before judging whether system images should switch from the monolithic bootloader derivation to the existing per-crate bootloader path.","rollback_reason":"Control run only; no product improvement intended.","next_action_hint":"Export `bootloaderPerCrate` from `packages.nix`, wire `system.nix` to use it, then compare against this control.","result":"Combined comment-only bootloader wiring control landed at total_ms=7451 with build_ms=6154.","control_use":"Use as immediate control for the bootloaderPerCrate wiring experiment."}}
{"run":107,"commit":"6d6c31a","metric":7307,"metrics":{"build_ms":5767,"run_ms":1539,"image_bytes":637534208},"status":"keep","description":"Keep wiring system images to the existing `bootloaderPerCrate` output: after a slower first pass, the steady rerun beat the same-path control on total_ms and build_ms.","timestamp":1776318645838,"segment":7,"confidence":1.9399209486166007,"iterationTokens":352,"asi":{"hypothesis":"Switching system builds from the monolithic bootloader derivation to the already-implemented `bootloaderPerCrate` path should reduce smoke-path eval/build work without changing product semantics.","result":"First candidate run landed at 7701 / build_ms 6273, but the steady rerun landed at total_ms=7307 with build_ms=5767 and run_ms=1539.","control_reference":"run 106 combined comment-only control was total_ms=7451 with build_ms=6154 and run_ms=1296.","reason_to_keep":"Primary metric improved and build_ms improved materially on the steady rerun; this is a product-wide system-image change, not a smoke-only shortcut.","notes":"This change only wires system.nix to use the existing per-crate bootloader path and exports that attr from packages.nix."}}
{"run":108,"commit":"47de3c5","metric":8271,"metrics":{"build_ms":5950,"run_ms":2320,"image_bytes":637534208},"status":"keep","description":"Retry keep after hook-formatting interruption: the `bootloaderPerCrate` wiring still passes smoke, and the code should be committed as the new product baseline despite noisy run_ms on this confirmation rerun.","timestamp":1776318714071,"segment":7,"confidence":1.9082426127527217,"iterationTokens":8472,"asi":{"hypothesis":"After restaging the formatter-adjusted files from the failed commit attempt, another keep cycle should record and commit the existing `bootloaderPerCrate` wiring change cleanly.","result":"Confirmation rerun with the same code landed at total_ms=8271 with build_ms=5950 and run_ms=2320; earlier steadier evidence for this change was run 107 at 7307 / 5767.","reason_to_keep":"This run is noisy, but it is only a commit-finalization retry for an already-evaluated product change whose earlier steady rerun beat the same-path control.","commit_recovery":"Previous keep attempt failed after hooks reformatted `packages.nix`; this run exists to let log_experiment recommit the same change cleanly.","notes":"Change exports `bootloaderPerCrate` from packages.nix and wires system.nix to use it for system images."}}
{"run":109,"commit":"cf9ff90","metric":7878,"metrics":{"build_ms":6014,"run_ms":1863,"image_bytes":637534208},"status":"keep","description":"Keep reverting the `bootloaderPerCrate` wiring: that prior keep was not on the active smoke benchmark path because the smoke runner is Cloud-Hypervisor-only and does not consume the `bootloader` arg used by QEMU paths.","timestamp":1776318779762,"segment":7,"confidence":1.9774375503626107,"iterationTokens":2937,"asi":{"hypothesis":"The previous `bootloaderPerCrate` keep was a benchmark confound: `functionalSmokeTest` runs only via Cloud Hypervisor, so changing the separate runner `bootloader` binding in `system.nix` should not count as a validated smoke-path optimization.","result":"Reverting the `bootloaderPerCrate` export/use still passes smoke; this run landed at total_ms=7878 with build_ms=6014 and run_ms=1863.","reason_to_keep":"This commit restores benchmark integrity by removing a change whose measured 'win' was not causally on the active CH smoke path.","causal_note":"`functionalSmokeTest` sets `defaultMode = \"ch\"` and `enableQemu = false`, and `mk-vm-test.nix` only uses the `bootloader` parameter on the QEMU launch path.","notes":"The per-crate bootloader builder itself remains available in packages.nix source as an implementation, but the system image/runners are switched back to the prior monolithic bootloader wiring until a relevant benchmark validates it."}}
