{"run":110,"commit":"cf9ff90","metric":7779,"metrics":{"build_ms":5927,"run_ms":1851,"image_bytes":637534208},"status":"discard","description":"Comment-only dirty control for `nix/redox-system/profiles/functional-smoke-test.nix` before testing whether a smaller initfs daemon set helps the CH smoke profile.","timestamp":1776318890821,"segment":7,"confidence":2.051839464882943,"iterationTokens":6237,"asi":{"hypothesis":"A same-file dirty control on the smoke profile is needed before judging initfs-daemon trimming for the benchmark profile.","rollback_reason":"Control run only; no product improvement intended.","next_action_hint":"Try excluding a small set of clearly nonessential initfs daemons like `acpid`, `hwd`, and `rtcd`, then compare against this control.","result":"Comment-only smoke-profile control landed at total_ms=7779 with build_ms=5927 and run_ms=1851.","control_use":"Use as immediate control for smoke-profile initfs-daemon trimming experiments."}}
{"run":111,"commit":"cf9ff90","metric":0,"metrics":{"build_ms":0,"run_ms":0,"image_bytes":0},"status":"crash","description":"Excluding `acpid`, `hwd`, and `rtcd` from the smoke profile's initfs daemon set broke boot; switchroot reached `redoxfs ... failed with exit status: 1` and the VM never reached the smoke test runner.","timestamp":1776318985950,"segment":7,"confidence":2.051839464882943,"iterationTokens":891,"asi":{"hypothesis":"The Cloud-Hypervisor smoke profile might not need initfs daemons like `acpid`, `hwd`, and `rtcd`, so excluding them could shrink initfs work and improve smoke timing.","rollback_reason":"Boot failed before the test suite could start, so this daemon-trim set is not safe for the smoke profile.","next_action_hint":"Do not exclude `acpid`, `hwd`, and `rtcd` together; if daemon trimming is revisited, reduce the blast radius and test one daemon at a time.","error_detail":"Serial log showed `redoxfs --uuid ... file 0000000000000000 failed with exit status: 1` during switchroot after dropping those daemons."}}
{"run":112,"commit":"8ca281f","metric":7482,"metrics":{"build_ms":5960,"run_ms":1521,"image_bytes":637534208},"status":"keep","description":"Keep excluding `rtcd` from the smoke profile initfs daemon set: after a rebuild-heavy first pass, the steady rerun beat the same-file smoke-profile control on total_ms and run_ms.","timestamp":1776319043711,"segment":7,"confidence":2.0467055879899916,"iterationTokens":363,"asi":{"hypothesis":"The CH smoke profile does not need the time daemon in initfs, so excluding only `rtcd` may trim boot work without breaking the smoke workload.","result":"The first candidate run rebuilt broadly and landed at 16844 / 15117, but the steady rerun landed at total_ms=7482 with build_ms=5960 and run_ms=1521.","control_reference":"run 110 comment-only smoke-profile control was total_ms=7779 with build_ms=5927 and run_ms=1851.","reason_to_keep":"Primary metric improved on the steady rerun, the smoke workload still boots and passes normally, and this is a profile-specific reduction in genuinely unused early-boot work rather than a fake success shortcut.","notes":"Do not combine this with broader daemon removals like `acpid`/`hwd`/`rtcd`; that broke boot."}}
{"run":113,"commit":"8ca281f","metric":8682,"metrics":{"build_ms":6480,"run_ms":2201,"image_bytes":637534208},"status":"discard","description":"Comment-only dirty control for the on-path `bootloaderPerCrate` wiring experiment, touching `system.nix` and `packages.nix` on top of the current baseline.","timestamp":1776319232960,"segment":7,"confidence":2.029776674937965,"iterationTokens":363,"asi":{"hypothesis":"A fresh same-path control is needed before judging whether wiring `bootloaderPerCrate` into `mkFlatPkgs` changes the active CH smoke build path.","rollback_reason":"Control run only; no product improvement intended.","next_action_hint":"Export `bootloaderPerCrate` again and wire it into `mkFlatPkgs.bootloader`, then compare against this control.","result":"On-path bootloaderPerCrate comment-only control landed at total_ms=8682 with build_ms=6480 and run_ms=2201.","control_use":"Use as immediate control for the on-path bootloaderPerCrate experiment."}}
{"run":114,"commit":"8ca281f","metric":0,"metrics":{"build_ms":0,"run_ms":0,"image_bytes":0},"status":"crash","description":"On-path `bootloaderPerCrate` wiring cannot currently build because its referenced plan file is missing from the repo: `nix/pkgs/system/bootloader-build-plan.json`.","timestamp":1776319273890,"segment":7,"confidence":2.029776674937965,"iterationTokens":1079,"asi":{"hypothesis":"Wiring `mkFlatPkgs.bootloader` to the existing `bootloaderPerCrate` path might reduce active smoke build work if the per-crate bootloader artifact is actually available.","rollback_reason":"Evaluation failed immediately because `nix/pkgs/system/bootloader-build-plan.json` does not exist in the tracked repo, so the candidate is not buildable as-is.","next_action_hint":"Do not pursue on-path `bootloaderPerCrate` until the missing build plan is generated and tracked; treat the current `bootloaderPerCrate` implementation as incomplete/dead code for this benchmark.","error_detail":"Nix error: `Path 'nix/pkgs/system/bootloader-build-plan.json' does not exist in Git repository`."}}
{"run":115,"commit":"8ca281f","metric":8651,"metrics":{"build_ms":6009,"run_ms":2642,"image_bytes":637534208},"status":"discard","description":"Fresh comment-only dirty control for the smoke profile after the kept `rtcd` trim, before testing whether excluding `hwd` as well is safe and beneficial.","timestamp":1776319317494,"segment":7,"confidence":2.0172626387176327,"iterationTokens":1458,"asi":{"hypothesis":"A new same-file control is needed on top of the current `rtcd`-trimmed smoke profile before judging any further initfs daemon trimming.","rollback_reason":"Control run only; no product improvement intended.","next_action_hint":"Add `hwd` to the smoke profile's `initfsExcludeDaemons` list and compare against this control.","result":"Fresh smoke-profile control on top of the `rtcd` trim landed at total_ms=8651 with build_ms=6009 and run_ms=2642.","control_use":"Use as immediate control for testing `hwd` exclusion on top of the current profile."}}
{"run":116,"commit":"8ca281f","metric":0,"metrics":{"build_ms":0,"run_ms":0,"image_bytes":0},"status":"crash","description":"Adding `hwd` to the smoke profile's initfs daemon exclusions broke boot on top of the kept `rtcd` trim; switchroot again failed at `redoxfs ... file 0000000000000000`.","timestamp":1776319428753,"segment":7,"confidence":2.0172626387176327,"iterationTokens":917,"asi":{"hypothesis":"The CH smoke profile might still boot and run without `hwd`, making it a safe follow-up trim after excluding only `rtcd`.","rollback_reason":"Boot failed before the smoke suite started, so `hwd` is not safe to exclude from the current smoke profile.","next_action_hint":"Do not exclude `hwd` from the smoke profile initfs. If daemon trimming continues, try a different daemon with smaller boot coupling or stop chasing this class.","error_detail":"Serial log showed `redoxfs --uuid ... file 0000000000000000 failed with exit status: 1` during switchroot after excluding `hwd`."}}
{"run":117,"commit":"8ca281f","metric":2484,"metrics":{"build_ms":219,"run_ms":2264,"image_bytes":637534208},"status":"discard","description":"Discard the ultra-hot-cache `rtcd+ptyd` smoke-profile run as a confounded measurement; this followed multiple unlabeled reruns and is not a fair basis for a keep decision.","timestamp":1776319534355,"segment":7,"confidence":2.029776674937965,"iterationTokens":462,"asi":{"hypothesis":"Excluding `ptyd` in addition to the kept `rtcd` trim might further reduce smoke-profile boot work.","rollback_reason":"The 2484ms result is obviously dominated by cache state drift rather than a fair A/B comparison, so it is not trustworthy keep evidence.","next_action_hint":"Use a direct hot-cache A/B: baseline current HEAD first, then reapply the saved `rtcd+ptyd` patch and rerun once for a fair comparison.","result":"Saved the candidate patch to `/tmp/rtcd-ptyd-smoke.patch` before discarding this confounded run.","error_detail":"Process note: multiple candidate reruns happened before logging; this discard resets the tree so the next comparison is clean."}}
{"run":118,"commit":"8ca281f","metric":8405,"metrics":{"build_ms":5775,"run_ms":2629,"image_bytes":637534208},"status":"discard","description":"Hot-cache baseline control on current HEAD (`rtcd` excluded, `ptyd` present) before reapplying the saved `rtcd+ptyd` candidate patch for a direct A/B.","timestamp":1776319556340,"segment":7,"confidence":2.0172626387176327,"iterationTokens":2346,"asi":{"hypothesis":"A direct hot-cache baseline is needed on the current kept tree before judging whether excluding `ptyd` on top of `rtcd` is a real improvement.","rollback_reason":"Control run only; no product improvement intended.","next_action_hint":"Apply `/tmp/rtcd-ptyd-smoke.patch`, rerun once under the same warmed cache conditions, and compare directly against this 8405ms baseline.","result":"Current-head hot baseline landed at total_ms=8405 with build_ms=5775 and run_ms=2629.","control_use":"Immediate A/B baseline for the `rtcd+ptyd` smoke-profile candidate."}}
{"run":119,"commit":"94eded2","metric":7847,"metrics":{"build_ms":5889,"run_ms":1958,"image_bytes":637534208},"status":"keep","description":"Keep excluding `ptyd` as well as `rtcd` from the smoke profile initfs daemon set: under a direct hot-cache A/B, the `rtcd+ptyd` profile beat the current-head baseline on total_ms by improving run_ms materially.","timestamp":1776319586531,"segment":7,"confidence":2.045,"iterationTokens":877,"asi":{"hypothesis":"The CH smoke profile does not need `ptyd` either, so excluding it on top of the kept `rtcd` trim should reduce early-boot work without breaking the smoke workload.","result":"Direct hot-cache baseline on current HEAD was 8405 / build_ms 5775 / run_ms 2629; reapplying the saved `rtcd+ptyd` patch produced 7847 / build_ms 5889 / run_ms 1958.","control_reference":"run 118 is the immediate hot-cache baseline for this A/B; earlier broader removal experiments showed `hwd` is unsafe to exclude.","reason_to_keep":"Primary metric improved under a fair same-cache comparison, the smoke workload still boots and passes normally, and the daemon appears genuinely unused for this profile.","notes":"`ptyd` removal slightly increased build_ms in this A/B but reduced run_ms enough to improve total_ms. Keep the blast radius narrow: do not combine this with `hwd` removal."}}
{"run":120,"commit":"94eded2","metric":9653,"metrics":{"build_ms":6678,"run_ms":2974,"image_bytes":637534208},"status":"discard","description":"Fresh current-head baseline before trying an on-path `bootloaderPerCrate` experiment backed by a newly generated tracked build plan.","timestamp":1776319868003,"segment":7,"confidence":2.0172626387176327,"iterationTokens":16048,"asi":{"hypothesis":"Need a clean current-head baseline on the active `rtcd+ptyd` smoke profile before introducing the missing bootloader build-plan file and wiring `mkFlatPkgs.bootloader` to `bootloaderPerCrate`.","rollback_reason":"Control run only; no product improvement intended.","next_action_hint":"Add `nix/pkgs/system/bootloader-build-plan.json`, export `bootloaderPerCrate`, wire it into `mkFlatPkgs.bootloader`, and compare directly against this baseline.","result":"Current-head baseline landed at total_ms=9653 with build_ms=6678 and run_ms=2974.","control_use":"Immediate control for the on-path bootloaderPerCrate experiment with a generated build plan."}}
{"run":121,"commit":"94eded2","metric":0,"metrics":{"build_ms":0,"run_ms":0,"image_bytes":0},"status":"crash","description":"Generating and wiring a tracked `bootloader-build-plan.json` exposed a deeper blocker in `bootloaderPerCrate`: after adding the missing plan, the on-path build still failed in the `aes` dependency with undefined `__extendhfsf2`/`__truncsfhf2` during UEFI linking.","timestamp":1776320111650,"segment":7,"confidence":2.0172626387176327,"iterationTokens":7522,"asi":{"hypothesis":"Supplying the missing `nix/pkgs/system/bootloader-build-plan.json` and a small `aes_force_soft` override might make the existing `bootloaderPerCrate` implementation buildable and let us benchmark it on the active smoke path.","rollback_reason":"The candidate still failed to build: `rust_aes-0.8.4.drv` hit linker errors for `__extendhfsf2` and `__truncsfhf2`, so `bootloaderPerCrate` is not ready for smoke benchmarking yet.","next_action_hint":"Treat `bootloaderPerCrate` as incomplete beyond the missing plan file. If revisited, investigate the UEFI per-crate toolchain/linker/compiler-builtins setup rather than only generating the plan.","error_detail":"Build log showed `rust-lld: error: undefined symbol: __extendhfsf2` and `__truncsfhf2` while building the `aes` crate for `x86_64-unknown-uefi`.","artifacts":"Generated plan was based on `nix run ../unit2nix -- --manifest-path <bootloader-src>/Cargo.toml --target x86_64-unknown-uefi --build-std core,alloc --build-std-features compiler-builtins-mem --bin bootloader`."}}
{"run":122,"commit":"94eded2","metric":8191,"metrics":{"build_ms":6103,"run_ms":2087,"image_bytes":637534208},"status":"discard","description":"Hot-cache baseline on current HEAD (`rtcd+ptyd` excluded) before testing whether excluding `ipcd` as well is safe and beneficial for the smoke profile.","timestamp":1776320165211,"segment":7,"confidence":2.0467055879899916,"iterationTokens":6236,"asi":{"hypothesis":"A direct hot-cache baseline is needed on the current kept `rtcd+ptyd` smoke profile before judging an `ipcd` exclusion candidate.","rollback_reason":"Control run only; no product improvement intended.","next_action_hint":"Exclude `ipcd` in addition to `rtcd+ptyd`, rerun once under the same warmed cache conditions, and compare directly against this baseline.","result":"Current-head hot baseline landed at total_ms=8191 with build_ms=6103 and run_ms=2087.","control_use":"Immediate A/B baseline for the `rtcd+ptyd+ipcd` smoke-profile candidate."}}
{"run":123,"commit":"9861e9f","metric":7135,"metrics":{"build_ms":5862,"run_ms":1272,"image_bytes":637534208},"status":"keep","description":"Keep excluding `ipcd` as well as `rtcd` and `ptyd` from the smoke profile initfs daemon set: after the rebuild-heavy first pass, the steady rerun beat the direct hot-cache baseline on total_ms, build_ms, and run_ms.","timestamp":1776320217375,"segment":7,"confidence":2.072635135135135,"iterationTokens":264,"asi":{"hypothesis":"The CH smoke profile does not need `ipcd` either, so excluding it on top of the kept `rtcd+ptyd` trim should reduce early-boot work without breaking the smoke workload.","result":"Direct hot-cache baseline on current HEAD was 8191 / build_ms 6103 / run_ms 2087; the `rtcd+ptyd+ipcd` candidate rerun landed at 7135 / build_ms 5862 / run_ms 1272.","control_reference":"run 122 is the immediate hot-cache baseline for this A/B; the first candidate run was rebuild-heavy at 17239 / 15309 / 1929.","reason_to_keep":"Primary metric improved under a fair same-cache comparison, the smoke workload still boots and passes normally, and `ipcd` appears genuinely unused for this profile.","notes":"Keep the blast radius narrow: `hwd` remains unsafe to exclude, and broader daemon cuts already broke boot."}}
{"run":124,"commit":"9861e9f","metric":72567,"metrics":{"build_ms":70095,"run_ms":2471,"image_bytes":637534208},"status":"discard","description":"Current-head baseline rerun on the `rtcd+ptyd+ipcd` smoke profile hit a rebuild-heavy cold path, so this result is not the fair hot-cache control for the next daemon-trim A/B.","timestamp":1776359240912,"segment":7,"confidence":2.0467055879899916,"iterationTokens":264,"asi":{"hypothesis":"Need a fresh current-head measurement before testing another narrow initfs-daemon exclusion on top of the kept `rtcd+ptyd+ipcd` smoke profile.","rollback_reason":"This run rebuilt broadly (`build_ms=70095`), so it is not the right control for a direct hot-cache comparison.","next_action_hint":"Rerun current HEAD once more to get the actual hot-cache baseline, then compare a one-daemon-at-a-time candidate against that result.","result":"Cold-ish current-head rerun landed at total_ms=72567 with build_ms=70095 and run_ms=2471.","control_use":"Discard as a rebuild-heavy warm-up; do not compare candidate trims against this number."}}
{"run":125,"commit":"9861e9f","metric":9891,"metrics":{"build_ms":6263,"run_ms":3627,"image_bytes":637534208},"status":"discard","description":"Hot-cache baseline control on current HEAD (`rtcd+ptyd+ipcd` excluded) before testing whether excluding another initfs daemon is safe and beneficial.","timestamp":1776359262398,"segment":7,"confidence":2.0306164666942492,"iterationTokens":935,"asi":{"hypothesis":"A fair hot-cache baseline is needed on the current kept smoke profile before judging any next one-daemon initfs trim.","rollback_reason":"Control run only; no product improvement intended.","next_action_hint":"Apply exactly one additional daemon exclusion on top of the current profile and compare directly against this 9891ms baseline.","result":"Current-head hot baseline landed at total_ms=9891 with build_ms=6263 and run_ms=3627.","control_use":"Immediate A/B baseline for the next single-daemon smoke-profile candidate."}}
{"run":126,"commit":"9861e9f","metric":17925,"metrics":{"build_ms":16421,"run_ms":1503,"image_bytes":637534208},"status":"discard","description":"First `acpid`-exclusion candidate run was rebuild-heavy, so it is only a warm-up and not fair evidence for or against keeping the trim.","timestamp":1776359384632,"segment":7,"confidence":2.0147783251231526,"iterationTokens":297,"asi":{"hypothesis":"The CH smoke profile might not need `acpid` on top of the kept `rtcd+ptyd+ipcd` trims, so excluding it could reduce early-boot work.","rollback_reason":"This first candidate run rebuilt broadly (`build_ms=16421`), so it is not a fair A/B against the hot-cache baseline.","next_action_hint":"Treat the first `acpid`-exclusion run as warm-up only; compare only against a true hot-cache rerun if the follow-up stays stable.","result":"Warm-up `acpid`-exclusion run landed at total_ms=17925 with build_ms=16421 and run_ms=1503."}}
{"run":127,"commit":"9861e9f","metric":51247,"metrics":{"build_ms":50090,"run_ms":1156,"image_bytes":637534208},"status":"discard","description":"Second `acpid`-exclusion rerun was even more confounded, rebuilding massively again, so this daemon-trim candidate still has no trustworthy A/B evidence.","timestamp":1776359401056,"segment":7,"confidence":1.9967453213995119,"iterationTokens":297,"asi":{"hypothesis":"A hot-cache rerun of the `acpid`-exclusion candidate would reveal whether the daemon trim helps the CH smoke profile.","rollback_reason":"The follow-up run was not hot-cache at all (`build_ms=50090`), so it cannot be used to judge the candidate.","next_action_hint":"Do not spend more time on `acpid` until the build path is stable enough for a clean A/B, or move to a different optimization class.","result":"Confounded follow-up `acpid`-exclusion run landed at total_ms=51247 with build_ms=50090 and run_ms=1156.","error_detail":"Repeated broad rebuilds prevented a fair comparison against the 9891ms hot-cache baseline."}}
{"run":128,"commit":"9861e9f","metric":9783,"metrics":{"build_ms":7614,"run_ms":2168,"image_bytes":637534208},"status":"discard","description":"Hot-cache baseline on current HEAD (`rtcd+ptyd+ipcd` excluded, CH smoke at 1024MiB/2 vCPUs) before testing smaller VM resources.","timestamp":1776359714469,"segment":7,"confidence":1.979032258064516,"iterationTokens":6441,"asi":{"hypothesis":"Need a fair current-head baseline before judging whether lower Cloud Hypervisor memory and CPU counts improve the active smoke benchmark.","rollback_reason":"Control run only; no product improvement intended.","next_action_hint":"Reduce the smoke profile's Cloud Hypervisor memory and CPU counts and compare directly against this baseline.","result":"Current-head hot baseline landed at total_ms=9783 with build_ms=7614 and run_ms=2168.","control_use":"Immediate A/B baseline for smoke-profile VM resource tuning."}}
{"run":129,"commit":"9861e9f","metric":16291,"metrics":{"build_ms":12617,"run_ms":3672,"image_bytes":637534208},"status":"discard","description":"Reducing functional-smoke-test Cloud Hypervisor resources to 512MiB/1 vCPU regressed badly on current rtcd+ptyd+ipcd-trimmed profile; build_ms and run_ms both worsened versus the 9783ms baseline.","timestamp":1776359948413,"segment":7,"confidence":1.9854368932038835,"iterationTokens":6441}
{"run":130,"commit":"9861e9f","metric":10074,"metrics":{"build_ms":7292,"run_ms":2781,"image_bytes":637534208},"status":"discard","description":"Fresh hot-cache baseline on current rtcd+ptyd+ipcd-trimmed smoke profile with 1024MiB/2 vCPUs before testing one-at-a-time Cloud Hypervisor resource reductions.","timestamp":1776360009494,"segment":7,"confidence":1.9902676399026764,"iterationTokens":2849}
{"run":131,"commit":"9861e9f","metric":62706,"metrics":{"build_ms":57565,"run_ms":5140,"image_bytes":637534208},"status":"discard","description":"First 512MiB/2-vCPU smoke-profile run rebuilt the image path heavily, so this is warm-up only and not fair evidence yet for a memory-only Cloud Hypervisor reduction.","timestamp":1776360094129,"segment":7,"confidence":1.9414556962025316,"iterationTokens":769}
{"run":132,"commit":"9861e9f","metric":150335,"metrics":{"build_ms":146360,"run_ms":3973,"image_bytes":637534208},"status":"discard","description":"Second 512MiB/2-vCPU rerun rebuilt even more broadly, so the memory-only Cloud Hypervisor reduction remains too confounded and costly to pursue on the current smoke benchmark.","timestamp":1776360261472,"segment":7,"confidence":1.8862413528055342,"iterationTokens":966}
