{"run":56,"commit":"0c2e1ff","metric":6552,"metrics":{"build_ms":5318,"run_ms":1233,"image_bytes":637534208},"status":"discard","description":"Validation rerun of the fully canonicalized GitLab metadata: unchanged code came in faster at 6552ms, confirming the relibc+ion warning cleanup is real and that the previous keep's run_ms was a noisy outlier.","timestamp":1776310697665,"segment":7,"confidence":2,"iterationTokens":1358,"asi":{"hypothesis":"Rerunning the unchanged fully canonicalized tree should confirm whether the 7233ms keep was real or just run_ms noise.","rollback_reason":"No code changes in this run; this is confirmation data only.","next_action_hint":"Treat the warning-cleanup class as finished and update the backlog toward post-warning dirty-build hotspots.","result":"Same code reran at total_ms=6552 with build_ms=5318 and no redirect warnings.","observed_noise":"Previous keep had run_ms=1859; rerun dropped to 1233 with the same build_ms neighborhood, so most remaining variance is runtime noise, not build regression."}}
{"run":57,"commit":"0c2e1ff","metric":6866,"metrics":{"build_ms":5506,"run_ms":1360,"image_bytes":637534208},"status":"discard","description":"First post-warning `object-src` top-level pruning pass included the one-time flake.lock update, so it cannot judge steady-state value yet.","timestamp":1776310837405,"segment":7,"confidence":1.4851157662624035,"iterationTokens":3979,"asi":{"hypothesis":"Now that relibc no longer needs the top-level `object-src` input and the warning class is fixed at the source/build-plan level, removing the unused flake input may shave a little more dirty eval overhead.","rollback_reason":"This first run paid the one-time lock-file removal cost and landed above the current observed best for the warning-cleaned tree, so it is not enough evidence to keep.","next_action_hint":"Reapply `/tmp/redox-prune-object-postwarn.patch` and rerun once; only keep if the steady-state rerun beats the current warning-cleaned runs.","saved_patch":"/tmp/redox-prune-object-postwarn.patch","result":"Smoke semantics unchanged; this was only flake-input plumbing.","observed_tradeoff":"With the warning class already fixed, any remaining gain from unused-input pruning is likely smaller and easier to drown in noise."}}
{"run":58,"commit":"0c2e1ff","metric":6733,"metrics":{"build_ms":5043,"run_ms":1689,"image_bytes":637534208},"status":"discard","description":"Steady-state post-warning `object-src` pruning did not pay off; build_ms improved a bit, but run_ms noise left total_ms above the current warning-cleaned best.","timestamp":1776310875760,"segment":7,"confidence":1.8825995807127882,"iterationTokens":1280,"asi":{"hypothesis":"If the now-unused top-level `object-src` input still carried measurable eval overhead, the rerun after lock maintenance would beat the current warning-cleaned tree.","rollback_reason":"Second-pass total_ms was 6733, still above the current observed best run for the warning-cleaned tree, so this extra flake-input pruning is not worth keeping.","next_action_hint":"Treat the URL-warning cleanup as the big remaining dirty-build win from this family; future work should target other hotspots, not more `object-src` plumbing.","result":"No clear overall win from removing the now-unused top-level `object-src` input.","observed_tradeoff":"build_ms dropped to 5043, but run_ms noise more than erased it at the primary metric level."}}
{"run":59,"commit":"0c2e1ff","metric":7101,"metrics":{"build_ms":5644,"run_ms":1456,"image_bytes":637534208},"status":"discard","description":"Dirty-tree control for `nix/flake-modules/system.nix`: comment-only touch near `mkFlatPkgs` measures the current no-op cost of editing this file under the smoke benchmark.","timestamp":1776311993666,"segment":7,"confidence":2.694,"iterationTokens":1280,"asi":{"hypothesis":"Before changing `mkFlatPkgs`, measure the dirty-tree baseline cost of touching `nix/flake-modules/system.nix` with no semantic change.","rollback_reason":"Comment-only control; no semantic improvement to keep.","next_action_hint":"Compare any `mkFlatPkgs` pruning against this 7101ms control, not just against earlier no-change reruns.","result":"Control run landed at total_ms=7101 with build_ms=5644.","control_use":"Use as dirty-tree reference for `system.nix` eval-path experiments."}}
{"run":60,"commit":"0c2e1ff","metric":7069,"metrics":{"build_ms":5601,"run_ms":1468,"image_bytes":637534208},"status":"discard","description":"Avoiding overridden `kernel`/`base` and `ion`/`userutils` values inside `mkFlatPkgs` did not buy a clear end-to-end win over the `system.nix` dirty-tree control.","timestamp":1776312063991,"segment":7,"confidence":3.592,"iterationTokens":1768,"asi":{"hypothesis":"If `mkFlatPkgs` eagerly evaluates the monolithic `modularPkgs.system` and overridden userspace entries before `//` discards them, selecting only the needed fields should reduce dirty-tree eval cost.","rollback_reason":"Total_ms only moved from the `system.nix` comment-only control 7101 to 7069, far too small and noisy to justify keeping.","next_action_hint":"Try the bigger eval hypothesis: remove the second `redox-env.nix` instantiation by having `system.nix` reuse environment data already computed in `packages.nix`.","result":"Smoke suite still passed, but build_ms only fell 43ms versus control.","control_reference":"run 59 `system.nix` dirty-tree control was 7101ms with build_ms=5644."}}
{"run":61,"commit":"0c2e1ff","metric":0,"metrics":{"build_ms":0,"run_ms":0,"image_bytes":0},"status":"crash","description":"First shared-env attempt crashed immediately because `system.nix` still referenced `inputs.*` later in the file after removing the old local `inputs = self.inputs` binding.","timestamp":1776312126227,"segment":7,"confidence":3.592,"iterationTokens":6232,"asi":{"hypothesis":"If `system.nix` reuses the environment already computed in `packages.nix` via `self'.legacyPackages`, the benchmark should avoid a second `redox-env.nix` / nixpkgs instantiation and cut eval-heavy build_ms.","rollback_reason":"Refactor broke evaluation before the benchmark started: `system.nix` had later `inputs.ripgrep-src` references and needed to keep the local `inputs = self.inputs` binding.","next_action_hint":"Restore the `inputs` binding and rerun the shared-env refactor; the failure was a local wiring bug, not evidence against the idea.","failure_detail":"`error: undefined variable 'inputs' at nix/flake-modules/system.nix:328:19`.","learned_scope":"System module can reuse shared env from `packages.nix`, but it still needs direct `inputs` for source-bundle helpers later in the file."}}
{"run":62,"commit":"0c2e1ff","metric":9170,"metrics":{"build_ms":7524,"run_ms":1645,"image_bytes":637534208},"status":"discard","description":"First shared-env pass regressed badly, so this run cannot justify the refactor yet; it likely paid a large one-time rebuild/eval churn from changing both `packages.nix` and `system.nix`.","timestamp":1776312175475,"segment":7,"confidence":2.694,"iterationTokens":2095,"asi":{"hypothesis":"If `system.nix` reuses `redox-env` data already computed in `packages.nix`, the smoke benchmark should avoid a second expensive env/nixpkgs instantiation and lower dirty build_ms.","rollback_reason":"Primary metric jumped to 9170ms on the first run, so this pass is not enough evidence to keep.","next_action_hint":"Reapply `/tmp/redox-share-redox-env.patch` and rerun once; if the second pass still loses to the 7101ms `system.nix` control and 6552 observed best, drop this refactor.","saved_patch":"/tmp/redox-share-redox-env.patch","result":"Smoke semantics stayed green; regression came from build/eval churn, not guest behavior.","observed_tradeoff":"Changing both flake modules appears to invalidate enough cached work that a second pass is needed before judging steady state."}}
{"run":63,"commit":"3813e84","metric":6126,"metrics":{"build_ms":4765,"run_ms":1361,"image_bytes":637534208},"status":"keep","description":"Keep shared flake env wiring: `packages.nix` now exports `legacyPackages.redoxEnv`, and `system.nix` reuses it instead of instantiating `redox-env.nix` a second time, dropping the dirty smoke benchmark from the 7101ms `system.nix` control to 6126.","timestamp":1776312198162,"segment":7,"confidence":4.6787416587225925,"iterationTokens":1412,"asi":{"hypothesis":"If `system.nix` reuses `redox-env` data already computed in `packages.nix`, the smoke benchmark should avoid a second expensive env/nixpkgs instantiation and lower dirty build_ms.","result":"Second pass improved total_ms to 6126 with build_ms=4765.","validation":"Smoke suite still passed 18/18 with unchanged image size. The first pass paid one-time churn from touching both flake modules, but the rerun beat both the 7101ms `system.nix` control and the prior warning-cleaned observed best.","key_design_choice":"Export the shared environment through `legacyPackages.redoxEnv` instead of adding new flake-module plumbing, so `system.nix` can reuse exactly the data already computed on the `packages.nix` path.","observed_tradeoff":"run_ms stayed noisy, but build_ms dropped by about 879ms versus the `system.nix` dirty control and about 553ms versus the prior warning-cleaned rerun.","next_action_hint":"Validation-rerun the kept shared-env tree, then prune stale ideas and look for the next flake-eval hotspot now that duplicate env evaluation is gone."}}
{"run":64,"commit":"3813e84","metric":5598,"metrics":{"build_ms":4622,"run_ms":976,"image_bytes":637534208},"status":"discard","description":"Validation rerun of the shared-env refactor came in even faster at 5598ms, confirming the duplicate `redox-env` evaluation was a real dirty-build hotspot and that the keep's run_ms was still a bit noisy.","timestamp":1776312213997,"segment":7,"confidence":4.469945355191257,"iterationTokens":1174,"asi":{"hypothesis":"Rerunning the unchanged shared-env tree should confirm whether the 6126ms keep was real or a one-off.","rollback_reason":"No code changes in this run; confirmation only.","next_action_hint":"Update notes/ideas around the eval hotspot, then hunt the next remaining flake-eval cost now that the duplicate env import is gone.","result":"Same code reran at total_ms=5598 with build_ms=4622 and run_ms=976.","observed_noise":"The kept run had run_ms=1361; validation rerun dropped to 976 while build_ms also improved slightly, so the new steady-state is comfortably below all prior warning-cleaned runs."}}
{"run":65,"commit":"3813e84","metric":6037,"metrics":{"build_ms":4903,"run_ms":1133,"image_bytes":637534208},"status":"discard","description":"Dirty-tree control for `nix/flake-modules/redox-env.nix`: comment-only touch near the shared env setup measures the current no-op cost of editing this file under the smoke benchmark.","timestamp":1776312289597,"segment":7,"confidence":3.289544235924933,"iterationTokens":2875,"asi":{"hypothesis":"Before changing how `redox-env.nix` gets overlayed nixpkgs, measure the dirty-tree baseline cost of touching this file with no semantic change.","rollback_reason":"Comment-only control; no semantic improvement to keep.","next_action_hint":"Compare any `pkgsWithOverlay` refactor against this 6037ms control, not just against earlier runs from other files.","result":"Control run landed at total_ms=6037 with build_ms=4903.","control_use":"Use as dirty-tree reference for `redox-env.nix` eval-path experiments."}}
{"run":66,"commit":"3813e84","metric":5678,"metrics":{"build_ms":4699,"run_ms":978,"image_bytes":637534208},"status":"discard","description":"First `pkgs.extend` pass beat the `redox-env.nix` comment-only control but did not yet beat the current shared-env tree's best observed run, so it needs one steady-state rerun before judgment.","timestamp":1776312322690,"segment":7,"confidence":2.6023329798515378,"iterationTokens":1305,"asi":{"hypothesis":"Using `pkgs.extend` for the rust overlay inside `redox-env.nix` may be cheaper than re-importing `inputs.nixpkgs` with an overlay for every Redox env instantiation.","rollback_reason":"Primary metric improved versus the same-file control but not enough yet versus the current best observed shared-env runs, so this first pass is not enough evidence to keep.","next_action_hint":"Reapply `/tmp/redox-env-pkgs-extend.patch` and rerun once; only keep if the steady-state rerun beats the current shared-env tree.","saved_patch":"/tmp/redox-env-pkgs-extend.patch","result":"Smoke suite stayed green and build_ms improved versus the `redox-env.nix` dirty control.","control_reference":"run 65 `redox-env.nix` dirty-tree control was 6037ms with build_ms=4903."}}
{"run":67,"commit":"3813e84","metric":5613,"metrics":{"build_ms":4640,"run_ms":972,"image_bytes":637534208},"status":"discard","description":"Steady-state `pkgs.extend` overlay wiring was effectively a wash: slightly better than the `redox-env.nix` dirty control, but still not better than the current shared-env tree's best observed run.","timestamp":1776312342517,"segment":7,"confidence":2.769751693002257,"iterationTokens":1198,"asi":{"hypothesis":"If `pkgs.extend` were meaningfully cheaper than re-importing nixpkgs-with-overlay inside `redox-env.nix`, the rerun after one-time churn would beat the current shared-env tree.","rollback_reason":"Second-pass total_ms 5613 is still above the current observed best 5598, so this overlay wiring tweak is not worth keeping.","next_action_hint":"Treat duplicate-env removal as the real eval win from this area; future work should target other remaining eval hotspots, not `pkgs.extend` vs `import nixpkgs` micro-tuning.","result":"Smoke suite stayed green and build_ms remained in the same neighborhood, but the primary metric did not improve.","control_reference":"run 65 `redox-env.nix` dirty-tree control was 6037ms; runs 66/67 show this tweak helps some, just not enough to justify another code path."}}
{"run":68,"commit":"3813e84","metric":6249,"metrics":{"build_ms":5105,"run_ms":1143,"image_bytes":637534208},"status":"discard","description":"First legacy core-packages pass regressed versus the current shared-env tree, so this refactor needs one steady-state rerun before judgment.","timestamp":1776312604415,"segment":7,"confidence":3.3162162162162163,"iterationTokens":3110,"asi":{"hypothesis":"If `system.nix` takes smoke-path core packages from `self'.legacyPackages` instead of `self'.packages`, it may avoid forcing the heavier `packages` output path during smoke evaluation.","rollback_reason":"First pass landed above the current observed best shared-env runs, so this single result is not enough evidence to keep.","next_action_hint":"Reapply `/tmp/redox-corepkgs-via-legacy.patch` and rerun once; keep only if the steady-state rerun beats the current shared-env tree.","saved_patch":"/tmp/redox-corepkgs-via-legacy.patch","result":"Smoke suite stayed green; any cost change is in flake evaluation, not runtime semantics.","observed_tradeoff":"This may still be valid after first-pass churn, but it started worse than the current tree."}}
{"run":69,"commit":"3813e84","metric":5915,"metrics":{"build_ms":4815,"run_ms":1099,"image_bytes":637534208},"status":"discard","description":"Steady-state legacy core-packages wiring still lost to the current shared-env tree, so routing smoke-path core packages through `legacyPackages` is not worth keeping.","timestamp":1776312624348,"segment":7,"confidence":3.3941908713692945,"iterationTokens":1095,"asi":{"hypothesis":"If `system.nix` pulled smoke-path core packages from `self'.legacyPackages` instead of `self'.packages`, it might avoid forcing the heavier package-output path during smoke evaluation.","rollback_reason":"Second-pass total_ms 5915 is still above the current observed best 5598, so this extra indirection is not a real win.","next_action_hint":"Keep the shared `redoxEnv` reuse, but drop further `legacyPackages` plumbing unless a later profile proves it helps.","saved_patch":"/tmp/redox-corepkgs-via-legacy.patch","result":"Smoke suite stayed green and build_ms remained respectable, but the primary metric did not improve enough.","observed_tradeoff":"Moving core packages into `legacyPackages` adds plumbing without beating the simpler shared-env design."}}
{"run":70,"commit":"3813e84","metric":6063,"metrics":{"build_ms":4862,"run_ms":1200,"image_bytes":637534208},"status":"discard","description":"Dirty-tree control for `nix/pkgs/infrastructure/mk-vm-test.nix`: comment-only touch near image staging measures the current no-op cost of editing the VM runner infrastructure.","timestamp":1776312692162,"segment":7,"confidence":3.5258620689655173,"iterationTokens":6271,"asi":{"hypothesis":"Before revisiting the Cloud Hypervisor overlay path, measure the dirty-tree baseline cost of touching `mk-vm-test.nix` with no semantic change.","rollback_reason":"Comment-only control; no semantic improvement to keep.","next_action_hint":"Compare any CH overlay candidate against this 6063ms control, not just against broader branch bests.","result":"Control run landed at total_ms=6063 with build_ms=4862.","control_use":"Use as dirty-tree reference for `mk-vm-test.nix` experiments."}}
{"run":71,"commit":"3813e84","metric":0,"metrics":{"build_ms":0,"run_ms":0,"image_bytes":0},"status":"crash","description":"Cloud Hypervisor qcow2 overlay retry crashed immediately: this CH build supports qcow2 images but has backing-file support disabled, so the overlay approach cannot replace the raw copy path here.","timestamp":1776312728985,"segment":7,"confidence":3.5258620689655173,"iterationTokens":1314,"asi":{"hypothesis":"A qcow2 overlay backed by the immutable store raw image would preserve exact guest semantics while removing the expensive CH raw-image copy from `mk-vm-test.nix`.","rollback_reason":"Cloud Hypervisor aborted before boot because qcow backing files are disabled in this build, so this path is unusable here.","next_action_hint":"Drop qcow2-overlay ideas for the current Cloud Hypervisor build; if revisiting run_ms work, try CH-supported disk formats or other staging strategies that do not depend on backing files.","failure_detail":"`Fatal error: VmBoot(... CreateQcowDiskSync(BackingFilesDisabled))` with warning `Non-raw image type detected` and explicit `Backing file support is disabled`.","learned_scope":"The earlier overlay hypothesis was blocked by the CH binary itself, not by benchmark noise. Any future qcow2 work needs no-backing-file conversion or a different VMM."}}
{"run":72,"commit":"3813e84","metric":6242,"metrics":{"build_ms":5188,"run_ms":1053,"image_bytes":637534208},"status":"discard","description":"Dirty-tree control for `nix/redox-system/profiles/functional-smoke-test.nix`: comment-only touch near the smoke profile knobs measures the current no-op cost of editing this profile.","timestamp":1776313425511,"segment":7,"confidence":4.103678929765886,"iterationTokens":17735,"asi":{"hypothesis":"Before changing smoke-specific hardware settings, measure the dirty-tree baseline cost of touching `functional-smoke-test.nix` with no semantic change.","rollback_reason":"Comment-only control; no semantic improvement to keep.","next_action_hint":"Compare any smoke-profile driver pruning against this 6242ms control, not just against branch-wide bests.","result":"Control run landed at total_ms=6242 with build_ms=5188.","control_use":"Use as dirty-tree reference for smoke-profile configuration experiments."}}
{"run":73,"commit":"3813e84","metric":15121,"metrics":{"build_ms":14083,"run_ms":1038,"image_bytes":637534208},"status":"discard","description":"First smoke-profile network-driver pruning pass rebuilt the smoke image path, so this run cannot judge steady-state value yet.","timestamp":1776313467725,"segment":7,"confidence":3.5258620689655173,"iterationTokens":883,"asi":{"hypothesis":"Because `functional-smoke-test` already has networking disabled, dropping `hardware.networkDrivers` to `[]` should remove unneeded VM NIC drivers from the smoke image without changing the workload.","rollback_reason":"Primary metric was dominated by first-run rebuild churn (~14s build_ms), so this pass is unusable as keep/discard evidence.","next_action_hint":"Reapply `/tmp/redox-smoke-no-net-drivers.patch` and rerun once; keep only if the steady-state pass beats the 6242ms smoke-profile control and the current shared-env tree.","saved_patch":"/tmp/redox-smoke-no-net-drivers.patch","result":"Smoke suite still passed with unchanged image size, so the candidate at least preserved current smoke semantics.","control_reference":"run 72 smoke-profile dirty control was 6242ms with build_ms=5188."}}
{"run":74,"commit":"3813e84","metric":6039,"metrics":{"build_ms":5002,"run_ms":1036,"image_bytes":637534208},"status":"discard","description":"Steady-state smoke-profile network-driver pruning beat the same-file control but still lost to the current shared-env tree, so removing VM NIC drivers from the smoke profile is not worth keeping on its own.","timestamp":1776313488443,"segment":7,"confidence":4.05955334987593,"iterationTokens":1073,"asi":{"hypothesis":"Because `functional-smoke-test` already has networking disabled, dropping `hardware.networkDrivers` to `[]` should remove unneeded VM NIC drivers from the smoke image without changing the workload.","rollback_reason":"Second-pass total_ms 6039 is still above the current observed best 5598, so this smoke-profile cleanup is not a real overall win.","next_action_hint":"Keep looking for larger eval/build wins; small smoke-profile driver pruning is below the remaining noise and does not move the primary metric enough.","saved_patch":"/tmp/redox-smoke-no-net-drivers.patch","result":"Smoke suite still passed and build_ms improved slightly versus the smoke-profile control, but the primary metric did not beat the current tree.","control_reference":"run 72 smoke-profile dirty control was 6242ms; run 74 improved that to 6039 but not enough versus the branch best."}}
