{"run":185,"commit":"ca47e08","metric":7210,"metrics":{"build_ms":6150,"run_ms":1059,"image_bytes":637534208},"status":"discard","description":"Fresh control using a clean detached unit2nix worktree at current upstream HEAD (9fcd411) via override-input; this real-input control landed at 7210ms before testing a lazy test/clippy-output patch.","timestamp":1776365035852,"segment":7,"confidence":1.3483516483516484,"iterationTokens":1534}
{"run":186,"commit":"ca47e08","metric":7182,"metrics":{"build_ms":6117,"run_ms":1064,"image_bytes":637534208},"status":"discard","description":"A local unit2nix patch that delays test/clippy graph construction until those outputs are accessed was effectively flat on the first clean override-input run: 7182ms versus the clean-head control at 7210ms.","timestamp":1776365077035,"segment":7,"confidence":1.4046937607326846,"iterationTokens":2098}
{"run":187,"commit":"ca47e08","metric":7036,"metrics":{"build_ms":5946,"run_ms":1089,"image_bytes":637534208},"status":"discard","description":"Second clean override-input rerun of the local unit2nix lazy test/clippy-graph patch improved to 7036ms, suggesting a small possible build_ms win versus the clean-head control, but not enough evidence yet to treat it as proven.","timestamp":1776365098112,"segment":7,"confidence":1.446081319976429,"iterationTokens":612}
{"run":188,"commit":"ca47e08","metric":7216,"metrics":{"build_ms":6138,"run_ms":1078,"image_bytes":637534208},"status":"discard","description":"Fresh clean-head control on a second detached unit2nix worktree confirmed current upstream HEAD around 7216ms, leaving the local lazy test/clippy-graph patch ahead by about 180ms but still below keep confidence.","timestamp":1776365131728,"segment":7,"confidence":1.4899817850637522,"iterationTokens":852}
