{"run":133,"commit":"9861e9f","metric":32084,"metrics":{"build_ms":30657,"run_ms":1424,"image_bytes":637534208},"status":"discard","description":"First 1024MiB/1-vCPU smoke-profile run rebuilt the image path heavily, so this is warm-up only and not fair evidence yet for a CPU-only Cloud Hypervisor reduction.","timestamp":1776360385723,"segment":7,"confidence":1.868290826037305,"iterationTokens":7996}
{"run":134,"commit":"9861e9f","metric":14558,"metrics":{"build_ms":11322,"run_ms":3235,"image_bytes":637534208},"status":"discard","description":"Second 1024MiB/1-vCPU rerun still lost badly versus the current rtcd+ptyd+ipcd-trimmed smoke profile; CPU-only Cloud Hypervisor reduction is not a promising path.","timestamp":1776360410382,"segment":7,"confidence":1.8423423423423424,"iterationTokens":714}
{"run":135,"commit":"9861e9f","metric":9359,"metrics":{"build_ms":8059,"run_ms":1299,"image_bytes":637534208},"status":"discard","description":"Fresh hot-cache baseline on current rtcd+ptyd+ipcd-trimmed smoke profile after pruning stale ideas and ruling out Cloud Hypervisor resource reductions.","timestamp":1776360511775,"segment":7,"confidence":1.6947513812154695,"iterationTokens":5720}
{"run":136,"commit":"5141ef0","metric":7424,"metrics":{"build_ms":6318,"run_ms":1105,"image_bytes":637534208},"status":"keep","description":"Keep excluding acpid as well as rtcd, ptyd, and ipcd from the smoke profile initfs daemon set: on current hot-cache A/B, the narrower CH smoke profile still boots/passes and improves total_ms, build_ms, and run_ms versus the fresh 9359ms baseline.","timestamp":1776360533250,"segment":7,"confidence":1.8423423423423424,"iterationTokens":673}
{"run":137,"commit":"5141ef0","metric":13872,"metrics":{"build_ms":10997,"run_ms":2872,"image_bytes":637534208},"status":"discard","description":"Validation rerun on the kept acpid+rtcd+ptyd+ipcd trim came in much slower, so this path may still be noise-sensitive and needs caution despite the first hot-cache win.","timestamp":1776360557238,"segment":7,"confidence":1.6947513812154695,"iterationTokens":932}
{"run":138,"commit":"5141ef0","metric":9877,"metrics":{"build_ms":7432,"run_ms":2442,"image_bytes":637534208},"status":"discard","description":"Hot-cache A side for acpid trim revalidation: current HEAD with rtcd+ptyd+ipcd+acpid excluded landed at 9877ms before reverting only acpid for the control half of the A/B.","timestamp":1776360682803,"segment":7,"confidence":1.594541910331384,"iterationTokens":932}
{"run":139,"commit":"5141ef0","metric":12336,"metrics":{"build_ms":9563,"run_ms":2771,"image_bytes":637534208},"status":"discard","description":"Hot-cache B side for acpid trim revalidation: reverting only acpid from the rtcd+ptyd+ipcd+acpid smoke profile lost clearly at 12336ms versus the 9877ms A-side run with acpid excluded.","timestamp":1776360710999,"segment":7,"confidence":1.5675503034174385,"iterationTokens":731}
{"run":140,"commit":"5141ef0","metric":10253,"metrics":{"build_ms":8938,"run_ms":1313,"image_bytes":637534208},"status":"discard","description":"Follow-up A-side validation for the kept acpid trim: current HEAD reran at 10253ms, still better than the 12336ms no-acpid control from the direct hot-cache A/B, though overall variance remains high.","timestamp":1776360732049,"segment":7,"confidence":1.5280199252801991,"iterationTokens":834}
{"run":141,"commit":"5141ef0","metric":9014,"metrics":{"build_ms":7743,"run_ms":1270,"image_bytes":637534208},"status":"discard","description":"Fresh hot-cache baseline on current rtcd+ptyd+ipcd+acpid-trimmed smoke profile before narrowing hardware drivers to the actual Cloud Hypervisor smoke workload.","timestamp":1776360854539,"segment":7,"confidence":1.5665496329396744,"iterationTokens":11293}
{"run":142,"commit":"5141ef0","metric":17414,"metrics":{"build_ms":15866,"run_ms":1547,"image_bytes":637534208},"status":"discard","description":"First virtio-only smoke-profile driver run rebuilt the image path heavily, so this is warm-up only and not fair evidence yet for narrowing hardware drivers to virtio-blkd with networking disabled.","timestamp":1776360883615,"segment":7,"confidence":1.5356695869837296,"iterationTokens":691}
{"run":143,"commit":"612c339","metric":7190,"metrics":{"build_ms":6144,"run_ms":1045,"image_bytes":637534208},"status":"keep","description":"Keep narrowing functional-smoke-test hardware drivers to the actual Cloud Hypervisor workload: setting storageDrivers to [virtio-blkd] and networkDrivers to [] on top of the rtcd+ptyd+ipcd+acpid trim cut the hot-cache smoke run from 9014ms to 7190ms.","timestamp":1776360904122,"segment":7,"confidence":1.5665496329396744,"iterationTokens":737}
{"run":144,"commit":"612c339","metric":7241,"metrics":{"build_ms":6185,"run_ms":1055,"image_bytes":637534208},"status":"discard","description":"Validation rerun of the virtio-only smoke-profile driver trim stayed near the keep at 7241ms, confirming the Cloud Hypervisor-specific hardware narrowing is a real hot-cache win.","timestamp":1776360922697,"segment":7,"confidence":1.5955786736020807,"iterationTokens":721}
{"run":145,"commit":"612c339","metric":17592,"metrics":{"build_ms":16435,"run_ms":1156,"image_bytes":637534208},"status":"discard","description":"First smoke-profile acpiEnable=false run rebuilt broadly, so this is warm-up only and not fair evidence yet for matching the acpid initfs trim at the /power config layer.","timestamp":1776360970562,"segment":7,"confidence":1.5665496329396744,"iterationTokens":2857}
{"run":146,"commit":"612c339","metric":8063,"metrics":{"build_ms":7015,"run_ms":1047,"image_bytes":637534208},"status":"discard","description":"Matching the acpid initfs trim at the /power config layer did not beat the current virtio-only smoke profile: acpiEnable=false still lost at 8063ms versus the current-head validation around 7241ms.","timestamp":1776360996261,"segment":7,"confidence":1.5955786736020807,"iterationTokens":730}
{"run":147,"commit":"612c339","metric":16233,"metrics":{"build_ms":15188,"run_ms":1044,"image_bytes":603979776},"status":"discard","description":"First 576MiB smoke-image run on the trimmed virtio-only profile rebuilt broadly, so this is warm-up only and not fair evidence yet for retrying a smaller disk after the newer daemon+driver wins.","timestamp":1776361036837,"segment":7,"confidence":1.5665496329396744,"iterationTokens":1433}
{"run":148,"commit":"612c339","metric":7399,"metrics":{"build_ms":6392,"run_ms":1006,"image_bytes":603979776},"status":"discard","description":"Retrying a 576MiB smoke image after the daemon+driver trims still did not beat the current 608MiB virtio-only profile; 7399ms remained slightly above the current-head validation around 7241ms.","timestamp":1776361058003,"segment":7,"confidence":1.5955786736020807,"iterationTokens":648}
{"run":149,"commit":"612c339","metric":87023,"metrics":{"build_ms":82428,"run_ms":4590,"image_bytes":637534208},"status":"discard","description":"First smoke-profile hwd-replacement run rebuilt the image path heavily, so this is warm-up only and not fair evidence yet for replacing hwd with a direct pcid service while excluding hwd and acpid.","timestamp":1776361272354,"segment":7,"confidence":1.5665496329396744,"iterationTokens":11066}
{"run":150,"commit":"612c339","metric":228891,"metrics":{"build_ms":221976,"run_ms":6914,"image_bytes":637534208},"status":"discard","description":"Replacing hwd with a direct pcid initfs service is a bad path here: even the follow-up run rebuilt massively and stayed catastrophically slower, so this smoke-profile service override is not worth pursuing further.","timestamp":1776361559437,"segment":7,"confidence":1.5356695869837296,"iterationTokens":801}
{"run":151,"commit":"612c339","metric":24261,"metrics":{"build_ms":17381,"run_ms":6879,"image_bytes":620756992},"status":"discard","description":"First 592MiB smoke-image run on the trimmed virtio-only profile was rebuild-heavy and runtime-noisy, so this is warm-up only and not fair evidence yet for an intermediate image size.","timestamp":1776361608498,"segment":7,"confidence":1.5195046439628483,"iterationTokens":1160}
{"run":152,"commit":"612c339","metric":8391,"metrics":{"build_ms":6283,"run_ms":2107,"image_bytes":620756992},"status":"discard","description":"An intermediate 592MiB smoke image still lost to the current 608MiB virtio-only profile; lower build_ms could not offset a much worse run_ms, leaving 8391ms above the current-head validation around 7241ms.","timestamp":1776361630672,"segment":7,"confidence":1.5366311834690043,"iterationTokens":643}
{"run":153,"commit":"612c339","metric":174329,"metrics":{"build_ms":172506,"run_ms":1822,"image_bytes":637534208},"status":"discard","description":"First reflink-auto rootTree copy run rebuilt the redoxfs image path heavily, so this is warm-up only and not fair evidence yet for switching make-redoxfs-image.nix from cp -r to cp -a --reflink=auto.","timestamp":1776361852789,"segment":7,"confidence":1.5195046439628483,"iterationTokens":2991}
{"run":154,"commit":"612c339","metric":24085,"metrics":{"build_ms":22918,"run_ms":1166,"image_bytes":637534208},"status":"discard","description":"Using cp -a --reflink=auto for the rootTree copy in make-redoxfs-image.nix is a bad path here; even the follow-up run stayed dramatically slower than the current tree, so this copy-mode tweak is stale.","timestamp":1776361893414,"segment":7,"confidence":1.4899817850637522,"iterationTokens":704}
{"run":155,"commit":"612c339","metric":95512,"metrics":{"build_ms":94463,"run_ms":1049,"image_bytes":637534208},"status":"discard","description":"Rebuild-heavy warm-up on current virtio-only smoke profile before testing a lived exclusion; this run is not a fair hot-cache baseline.","timestamp":1776362601730,"segment":7,"confidence":1.446081319976429,"iterationTokens":2887}
{"run":156,"commit":"612c339","metric":12376,"metrics":{"build_ms":9978,"run_ms":2396,"image_bytes":637534208},"status":"discard","description":"Current-head hot-cache baseline on the virtio-only smoke profile before testing whether excluding lived further trims the initfs path.","timestamp":1776362625032,"segment":7,"confidence":1.4046937607326846,"iterationTokens":526}
{"run":157,"commit":"612c339","metric":18694,"metrics":{"build_ms":17672,"run_ms":1021,"image_bytes":637534208},"status":"discard","description":"First lived-exclusion smoke-profile run rebuilt broadly, so this is warm-up only and not fair evidence yet for dropping lived from the initfs daemon set.","timestamp":1776362669332,"segment":7,"confidence":1.3483516483516484,"iterationTokens":673}
{"run":158,"commit":"ca47e08","metric":7022,"metrics":{"build_ms":5992,"run_ms":1029,"image_bytes":637534208},"status":"keep","description":"Keep excluding lived as well as rtcd, ptyd, ipcd, and acpid from the smoke profile initfs daemon set: after warm-up, the lived-trimmed profile beat the current-head baseline at 7022ms versus 12376ms.","timestamp":1776362690839,"segment":7,"confidence":1.4046937607326846,"iterationTokens":684}
{"run":159,"commit":"ca47e08","metric":7257,"metrics":{"build_ms":6239,"run_ms":1018,"image_bytes":637534208},"status":"discard","description":"Validation rerun of the lived-trimmed virtio-only smoke profile stayed near the keep at 7257ms, confirming the lived exclusion is a real hot-cache win rather than a one-off.","timestamp":1776362708642,"segment":7,"confidence":1.446081319976429,"iterationTokens":664}
{"run":160,"commit":"ca47e08","metric":26281,"metrics":{"build_ms":24006,"run_ms":2272,"image_bytes":603979776},"status":"discard","description":"First 576MiB rerun on the latest lived-trimmed virtio-only profile rebuilt broadly, so this is warm-up only and not fair evidence yet for rechecking the smaller image on the slimmer tree.","timestamp":1776362778159,"segment":7,"confidence":1.4046937607326846,"iterationTokens":1937}
{"run":161,"commit":"ca47e08","metric":7380,"metrics":{"build_ms":6476,"run_ms":903,"image_bytes":603979776},"status":"discard","description":"Even on the newest lived-trimmed virtio-only profile, a 576MiB smoke image still lost to the current 608MiB configuration; better run_ms could not offset higher build_ms, leaving 7380ms above the current-head validation around 7257ms.","timestamp":1776362805206,"segment":7,"confidence":1.446081319976429,"iterationTokens":646}
{"run":162,"commit":"ca47e08","metric":0,"metrics":{"build_ms":0,"run_ms":0,"image_bytes":0},"status":"crash","description":"A 32MiB ESP is too small for the current smoke image: the build failed before benchmarking, so this ESP cut is not viable as-is.","timestamp":1776362836815,"segment":7,"confidence":1.446081319976429,"iterationTokens":825}
{"run":163,"commit":"ca47e08","metric":18538,"metrics":{"build_ms":16888,"run_ms":1649,"image_bytes":637534208},"status":"discard","description":"First 48MiB-ESP run rebuilt broadly, so this is warm-up only and not fair evidence yet for a smaller ESP on the lived-trimmed virtio-only profile.","timestamp":1776362881612,"segment":7,"confidence":1.4046937607326846,"iterationTokens":1702}
{"run":164,"commit":"ca47e08","metric":0,"metrics":{"build_ms":0,"run_ms":0,"image_bytes":0},"status":"crash","description":"Second 48MiB-ESP attempt was confounded by an unrelated Nix store failure (`rust_termion-4.0.5.drv` invalid path), so this candidate still lacks fair evidence either way.","timestamp":1776363116584,"segment":7,"confidence":1.4046937607326846,"iterationTokens":631}
{"run":165,"commit":"ca47e08","metric":86329,"metrics":{"build_ms":85462,"run_ms":866,"image_bytes":637534208},"status":"discard","description":"Current-head rerun after the unrelated store-path failure was itself rebuild-heavy, so the benchmark environment is noisy again and this run should be treated as warm-up only.","timestamp":1776363216389,"segment":7,"confidence":1.3483516483516484,"iterationTokens":713}
{"run":166,"commit":"ca47e08","metric":6873,"metrics":{"build_ms":6014,"run_ms":858,"image_bytes":637534208},"status":"discard","description":"Post-warm-up current-head rerun on the lived-trimmed virtio-only smoke profile came in at 6873ms, confirming the current tree is still the benchmark leader after the temporary Nix-store noise.","timestamp":1776363239465,"segment":7,"confidence":1.4046937607326846,"iterationTokens":547}
{"run":167,"commit":"ca47e08","metric":13774,"metrics":{"build_ms":12914,"run_ms":859,"image_bytes":637534208},"status":"discard","description":"A 48MiB ESP is a bad path on the current lived-trimmed virtio-only profile: run_ms stayed flat but build_ms regressed sharply, so the smaller ESP does not help this benchmark.","timestamp":1776363278297,"segment":7,"confidence":1.3483516483516484,"iterationTokens":832}
{"run":168,"commit":"ca47e08","metric":12515,"metrics":{"build_ms":11638,"run_ms":876,"image_bytes":637534208},"status":"discard","description":"Comment-only dirty control for make-disk-image.nix on the current lived-trimmed virtio-only smoke profile, before testing installPhase cp-to-mv output moves.","timestamp":1776363404194,"segment":7,"confidence":1.2963549920760697,"iterationTokens":23939}
{"run":169,"commit":"ca47e08","metric":12429,"metrics":{"build_ms":11566,"run_ms":862,"image_bytes":637534208},"status":"discard","description":"Replacing make-disk-image.nix installPhase `cp disk.img` with `mv disk.img` was effectively flat against the same-file dirty control: 12429ms / build_ms 11566 versus the 12515ms / 11638 control is too small to trust.","timestamp":1776363437518,"segment":7,"confidence":1.2774596564289433,"iterationTokens":691}
{"run":170,"commit":"ca47e08","metric":30424,"metrics":{"build_ms":29238,"run_ms":1185,"image_bytes":637534208},"status":"discard","description":"First smoke-only diskImageBootCompat=false run rebuilt broadly, so this is warm-up only and not fair evidence yet for skipping copied $out/boot compatibility files on the smoke disk-image output.","timestamp":1776363589662,"segment":7,"confidence":1.25910723447922,"iterationTokens":10360}
{"run":171,"commit":"ca47e08","metric":8401,"metrics":{"build_ms":7427,"run_ms":973,"image_bytes":637534208},"status":"discard","description":"Skipping copied $out/boot compatibility files on the smoke disk-image output did not help the current lived-trimmed profile; 8401ms still lost badly versus the current-head warm rerun at 6873ms.","timestamp":1776363631583,"segment":7,"confidence":1.2774596564289433,"iterationTokens":1774}
{"run":172,"commit":"ca47e08","metric":0,"metrics":{"build_ms":0,"run_ms":0,"image_bytes":0},"status":"crash","description":"The mk-vm-test same-file control was confounded by another unrelated Nix store failure (`rust_libc-0.2.183.drv` invalid path), so this run provides no evidence about runtime disk staging changes.","timestamp":1776363926141,"segment":7,"confidence":1.2774596564289433,"iterationTokens":1774}
{"run":173,"commit":"ca47e08","metric":79856,"metrics":{"build_ms":78810,"run_ms":1045,"image_bytes":637534208},"status":"discard","description":"Current-head rerun after the unrelated Nix-store failure was rebuild-heavy again, so this run is warm-up only and not a fair baseline for the mk-vm-test staging experiment.","timestamp":1776364018530,"segment":7,"confidence":1.25910723447922,"iterationTokens":599}
{"run":174,"commit":"ca47e08","metric":7448,"metrics":{"build_ms":6393,"run_ms":1054,"image_bytes":637534208},"status":"discard","description":"Current-head hot-cache rerun after the recent store-path noise landed at 7448ms, restoring a fair warm baseline before retrying the mk-vm-test staging experiment.","timestamp":1776364036025,"segment":7,"confidence":1.2774596564289433,"iterationTokens":504}
{"run":175,"commit":"ca47e08","metric":7465,"metrics":{"build_ms":6500,"run_ms":964,"image_bytes":637534208},"status":"discard","description":"Comment-only dirty control for mk-vm-test.nix on the current lived-trimmed virtio-only smoke profile, before testing sparse runtime disk staging.","timestamp":1776364067574,"segment":7,"confidence":1.2963549920760697,"iterationTokens":718}
{"run":176,"commit":"ca47e08","metric":7602,"metrics":{"build_ms":6617,"run_ms":984,"image_bytes":637534208},"status":"discard","description":"Sparse runtime disk staging in mk-vm-test.nix did not help on the current smoke profile; cp --sparse=always lost slightly against the same-file dirty control (7602ms / 6617 / 984 vs 7465ms / 6500 / 964).","timestamp":1776364093386,"segment":7,"confidence":1.3483516483516484,"iterationTokens":635}
{"run":177,"commit":"ca47e08","metric":15019,"metrics":{"build_ms":13987,"run_ms":1031,"image_bytes":637534208},"status":"discard","description":"First combined cp-to-mv image-builder run rebuilt the esp/redoxfs/disk outputs broadly, so this is warm-up only and not fair evidence yet for moving final image artifacts into $out instead of copying them.","timestamp":1776364152432,"segment":7,"confidence":1.2963549920760697,"iterationTokens":2792}
{"run":178,"commit":"ca47e08","metric":8304,"metrics":{"build_ms":7257,"run_ms":1046,"image_bytes":637534208},"status":"discard","description":"Moving final esp/redoxfs/disk image artifacts into $out with mv still lost on the current lived-trimmed profile; the warm follow-up landed at 8304ms, well above the current-head warm runs around 6873-7448ms.","timestamp":1776364179262,"segment":7,"confidence":1.3483516483516484,"iterationTokens":874}
{"run":179,"commit":"ca47e08","metric":8025,"metrics":{"build_ms":6969,"run_ms":1055,"image_bytes":637534208},"status":"discard","description":"Fresh hot-cache baseline on the current lived-trimmed virtio-only smoke profile before testing whether initSkip can avoid spawning hwd without excluding it from the initfs.","timestamp":1776364226870,"segment":7,"confidence":1.4046937607326846,"iterationTokens":2570}
{"run":180,"commit":"ca47e08","metric":0,"metrics":{"build_ms":0,"run_ms":0,"image_bytes":0},"status":"crash","description":"Using initSkip to suppress hwd is not a safe substitute for excluding it: the smoke image built, but boot failed during switchroot with `redoxfs ... file 0000000000000000 failed with exit status: 1`.","timestamp":1776364338584,"segment":7,"confidence":1.4046937607326846,"iterationTokens":1449}
{"run":181,"commit":"ca47e08","metric":15138,"metrics":{"build_ms":14100,"run_ms":1037,"image_bytes":637534208},"status":"discard","description":"Current local unit2nix HEAD override-input run was rebuild-heavy, so this first pass is only warm-up and not fair evidence yet for updating Redox to the newer upstream input.","timestamp":1776364452026,"segment":7,"confidence":1.3483516483516484,"iterationTokens":8542}
{"run":182,"commit":"ca47e08","metric":7999,"metrics":{"build_ms":6963,"run_ms":1035,"image_bytes":637534208},"status":"discard","description":"Current local unit2nix HEAD still loses to the locked input on the lived-trimmed smoke profile; the warm override-input rerun landed at 7999ms, well above the current-head warm runs around 6873-7448ms.","timestamp":1776364471426,"segment":7,"confidence":1.4046937607326846,"iterationTokens":523}
{"run":183,"commit":"ca47e08","metric":51524,"metrics":{"build_ms":50451,"run_ms":1072,"image_bytes":637534208},"status":"discard","description":"First override-input run with a local unit2nix patch that disables test/clippy outputs by default rebuilt broadly, so this pass is only warm-up and not fair evidence yet for that upstream lever.","timestamp":1776364820453,"segment":7,"confidence":1.3483516483516484,"iterationTokens":23361}
{"run":184,"commit":"ca47e08","metric":14000,"metrics":{"build_ms":12992,"run_ms":1007,"image_bytes":637534208},"status":"discard","description":"Disabling unit2nix test/clippy outputs by default in the local override input was a bad path here; the warm rerun still landed at 14000ms, much worse than both the locked input and the unpatched local unit2nix HEAD.","timestamp":1776364851699,"segment":7,"confidence":1.2963549920760697,"iterationTokens":540}
