{"run":19,"commit":"159fa82","metric":8659,"metrics":{"build_ms":7612,"run_ms":1046,"image_bytes":637534208},"status":"keep","description":"Keep the targeted chmod/copy path in `make-redoxfs-image.nix`: copy with `${rootTree}/.` and make only the handful of directories we actually mutate writable, trimming the 608MB smoke benchmark from 8700ms to 8659ms.","timestamp":1776304662820,"segment":4,"confidence":3.0945646145313366,"iterationTokens":1060,"asi":{"hypothesis":"The first targeted-chmod run was rebuild-noisy; steady state should show whether avoiding a full recursive chmod wins anything on the smaller smoke image.","result":"Improved total_ms to 8659 with build_ms=7612 and unchanged image_bytes=637534208.","validation":"Smoke suite still passed 18/18 on the 608MB image.","key_design_choice":"Use dotfile-safe `cp -r ${rootTree}/.` and replace `chmod -R u+w root/` with targeted directory writes only.","next_action_hint":"Runner-side copy path is now the next obvious small lever; test whether `cp --reflink=auto --sparse=always` helps when copying the raw image into the VM work dir."}}
{"run":20,"commit":"159fa82","metric":9024,"metrics":{"build_ms":7992,"run_ms":1031,"image_bytes":637534208},"status":"discard","description":"Runner copy experiment with `cp --reflink=auto --sparse=always` did not help the 608MB smoke benchmark; total_ms regressed slightly despite a small run_ms drop.","timestamp":1776304695708,"segment":4,"confidence":2.743117010816126,"iterationTokens":1295,"asi":{"hypothesis":"Preserving holes or opportunistic reflinks when copying the raw image into the VM work dir might shave runner startup time.","rollback_reason":"Primary metric regressed from 8659ms to 9024ms, so any run_ms gain was outweighed by build/package overhead or no-op behavior.","next_action_hint":"Skip copy-flag tweaks for now; better ROI likely comes from more structural image-size or builder-path changes.","result":"run_ms improved modestly to 1031ms, but build_ms rose to 7992ms and total_ms worsened.","observed_tradeoff":"Copy-path tweaks are too small relative to benchmark noise and package rebuild overhead."}}
{"run":21,"commit":"159fa82","metric":14333,"metrics":{"build_ms":13327,"run_ms":1005,"image_bytes":637534208},"status":"discard","description":"First sparse-dd pass in `make-disk-image.nix` built cleanly and trimmed run_ms, but the initial measured total_ms stayed above the current best because the changed disk image had to rebuild.","timestamp":1776304757588,"segment":4,"confidence":3.002152273338714,"iterationTokens":1868,"asi":{"hypothesis":"Using `dd conv=sparse,notrunc` when assembling the final disk image will preserve holes from the sparse partition images, cutting disk-image write and copy work.","rollback_reason":"Primary metric on the first run was still worse than the best 8659ms, so this needs a steady-state rerun before keeping.","next_action_hint":"Reapply the sparse-dd change and rerun once; if the second pass beats 8659ms, keep it.","result":"run_ms improved to 1005ms while image_bytes stayed constant, suggesting sparse physical writes may help even though apparent size is unchanged.","key_design_choice":"Preserve sparsity during final GPT assembly rather than forcing zero blocks to become real writes."}}
{"run":22,"commit":"159fa82","metric":8812,"metrics":{"build_ms":7786,"run_ms":1025,"image_bytes":637534208},"status":"discard","description":"Steady-state sparse-dd image assembly did not beat the current best; preserving holes in the final GPT image helped run_ms somewhat but still landed slightly above the targeted-chmod baseline.","timestamp":1776304786562,"segment":4,"confidence":2.0803504847129006,"iterationTokens":990,"asi":{"hypothesis":"If sparse final-image assembly was a real win, the rerun after rebuilding the disk image once would beat 8659ms.","rollback_reason":"Second-pass total_ms was 8812ms, still worse than the current best 8659ms, so this variant is not worth keeping.","next_action_hint":"Keep the simpler non-sparse disk assembly and look for higher-ROI wins elsewhere.","result":"build_ms=7786 and run_ms=1025 were both respectable, but not enough to beat the best total.","observed_tradeoff":"Sparse final-image assembly narrows the gap but does not outperform the current 608MB + fallocate + targeted-chmod combination."}}
{"run":23,"commit":"159fa82","metric":20501,"metrics":{"build_ms":19346,"run_ms":1154,"image_bytes":637534208},"status":"discard","description":"First `extraPkgs = {}` pass for `functionalSmokeTestSystem` built cleanly but, on the initial rebuild of the smoke outputs, measured worse than the current best.","timestamp":1776305095055,"segment":4,"confidence":3.002152273338714,"iterationTokens":4159,"asi":{"hypothesis":"The smoke test only uses core packages from the flat package set, so dropping the large `extraPkgs` attrset from `functionalSmokeTestSystem` should cut flake eval/build graph overhead.","rollback_reason":"Primary metric on the first run was still worse than the best 8659ms, so this needs a steady-state rerun before keeping.","next_action_hint":"Reapply the `extraPkgs = {}` change and rerun once; if the second pass beats 8659ms, keep it.","result":"Candidate preserved image_bytes but first-run build_ms remained rebuild-dominated.","key_design_choice":"Let the smoke system depend only on the flat package set instead of threading the full extra package overlay through mkSystem."}}
{"run":24,"commit":"9042d4d","metric":8194,"metrics":{"build_ms":7177,"run_ms":1016,"image_bytes":637534208},"status":"keep","description":"Keep `extraPkgs = {}` for `functionalSmokeTestSystem`: the smoke image only needs the flat package set, and dropping the large extra overlay lowers steady-state total_ms from 8659 to 8194.","timestamp":1776305121662,"segment":4,"confidence":2.1670395227442207,"iterationTokens":977,"asi":{"hypothesis":"The first no-extraPkgs run was rebuild-noisy; a steady-state rerun would show whether trimming the smoke system’s package graph reduces eval/build overhead.","result":"Improved total_ms to 8194 with build_ms=7177 and run_ms=1016.","validation":"Smoke suite still passed 18/18 with unchanged image_bytes and package contents needed by the smoke profile.","key_design_choice":"Keep the smoke test isolated from the large `extraPkgs` overlay; rely only on the flat package set already present in `mkSystem`.","next_action_hint":"Next likely ROI is reducing remaining eval/store traversal around the benchmark package, or probing whether the smoke runner can use a lighter VM config without hurting boot/test stability."}}
{"run":25,"commit":"9042d4d","metric":8345,"metrics":{"build_ms":7293,"run_ms":1051,"image_bytes":637534208},"status":"discard","description":"Lowering smoke VM resources to 512MB / 1 vCPU slightly regressed the benchmark; the smaller VM did not offset the slower boot/test path.","timestamp":1776305154822,"segment":4,"confidence":2.1192342752962627,"iterationTokens":1355,"asi":{"hypothesis":"A smaller VM for the smoke suite might reduce launch overhead enough to beat the current 1024MB / 2 vCPU config.","rollback_reason":"Primary metric regressed from 8194ms to 8345ms, with both build_ms and run_ms slightly worse.","next_action_hint":"Keep the 1024MB / 2 vCPU smoke VM and focus on build-graph or image-assembly changes instead.","result":"The lighter VM was not faster for this workload.","observed_tradeoff":"Reducing VM resources increased run_ms enough to outweigh any launch savings."}}
{"run":26,"commit":"9042d4d","metric":18256,"metrics":{"build_ms":17232,"run_ms":1023,"image_bytes":629145600},"status":"discard","description":"First 600MB / 56MB-ESP pass built and booted, trimming the image a bit further, but the initial measured total_ms stayed above the current best.","timestamp":1776305319889,"segment":4,"confidence":2.1670395227442207,"iterationTokens":8038,"asi":{"hypothesis":"If 64MB ESP is still oversized, dropping to 56MB and a 600MB total image should shave a little more copy/build cost while preserving the same smoke workload.","rollback_reason":"Primary metric on the first run was still worse than the best 8194ms, so this needs a steady-state rerun before keeping.","next_action_hint":"Reapply the 600/56 sizing and rerun once; if the second pass beats 8194ms, keep it.","result":"image_bytes fell to 629145600 and run_ms improved to 1023ms, but first-run build noise dominated total_ms.","key_design_choice":"Trim both total image and ESP cautiously while staying above the observed boot artifact footprint."}}
{"run":27,"commit":"9042d4d","metric":8412,"metrics":{"build_ms":7398,"run_ms":1013,"image_bytes":629145600},"status":"discard","description":"Steady-state 600MB / 56MB-ESP sizing still missed the current best; the slightly smaller image improved run_ms but not enough to beat the 608MB / 64MB configuration.","timestamp":1776305345626,"segment":4,"confidence":2.1192342752962627,"iterationTokens":1017,"asi":{"hypothesis":"If 600/56 were better than 608/64, the rerun after rebuilding once would beat 8194ms.","rollback_reason":"Second-pass total_ms was 8412ms, still above the best 8194ms, so this extra size cut is not worth keeping.","next_action_hint":"Stick with 608/64 and look for non-sizing wins; smaller disk tweaks are now in diminishing-returns territory.","result":"image_bytes dropped to 629145600 and run_ms to 1013ms, but build_ms remained worse than the best configuration.","observed_tradeoff":"ESP/disk size tweaks below 608/64 reduce bytes but no longer improve total benchmark time."}}
{"run":28,"commit":"9042d4d","metric":8441,"metrics":{"build_ms":7408,"run_ms":1032,"image_bytes":637534208},"status":"discard","description":"Building only `.#functionalSmokeTest` and discovering the disk image via `nix path-info -r` was slightly slower than building the runner and image together.","timestamp":1776305470687,"segment":4,"confidence":3.3697637338744744,"iterationTokens":1017,"asi":{"hypothesis":"Dropping the second top-level `nix build` target would reduce eval and closure-traversal overhead because the runner already depends on the smoke disk image.","rollback_reason":"Primary metric regressed from 8194ms to 8441ms on a steady-state script-only change, so the extra `nix path-info -r` walk costs more than the second installable saves.","next_action_hint":"Avoid extra closure walks in the harness; higher ROI is likely inside the flake output graph or image build path, not shell-level target selection.","result":"No-op benchmark semantics preserved, but build_ms worsened to 7408ms.","observed_tradeoff":"One build target plus one recursive path-info scan lost to the two-target direct build."}}
{"run":29,"commit":"9ce18e8","metric":8112,"metrics":{"build_ms":7082,"run_ms":1029,"image_bytes":637534208},"status":"keep","description":"Keep the Cloud-Hypervisor-only smoke runner path: parameterized `mkVmTest` / `mkFunctionalTest` to disable unused VMM backends, and `functionalSmokeTest` now emits a CH-only runner without QEMU/OVMF baggage, lowering total_ms from 8194 to 8112.","timestamp":1776305694712,"segment":4,"confidence":11.788519637462235,"iterationTokens":15917,"asi":{"hypothesis":"The smoke benchmark runs only on KVM/Cloud Hypervisor here, so omitting the unused QEMU backend from the smoke runner closure should reduce package-graph and closure-traversal overhead.","result":"Improved total_ms to 8112 with build_ms=7082 and unchanged image_bytes.","validation":"Smoke suite still passed 18/18; general functional-test runners still keep both backends, while smoke runner explicitly uses `defaultMode = \"ch\"` and `enableQemu = false`.","key_design_choice":"Make VMM backend inclusion explicit in `mkVmTest` instead of always embedding both launchers into every runner script.","next_action_hint":"Re-measure closure size and look for the next removable runner dependency, or prune stale ideas and try a deeper build-graph reduction if remaining gains are now sub-100ms."}}
{"run":30,"commit":"9ce18e8","metric":0,"metrics":{"build_ms":0,"run_ms":0,"image_bytes":0},"status":"crash","description":"Canonicalizing GitLab URLs to add `.git` crashed immediately: flake-style `gitlab:` inputs treat `.git` as part of the project path, so `object.git` fetched a nonexistent project.","timestamp":1776305792039,"segment":4,"confidence":11.788519637462235,"iterationTokens":5068,"asi":{"hypothesis":"Eliminating the repeated GitLab redirect warnings by switching URLs to their canonical `.git` forms might cut eval/build overhead.","rollback_reason":"`gitlab:` flake input syntax does not accept the `.git` suffix as a harmless alias; it changed the project name and broke fetch with HTTP 404 before the benchmark started.","next_action_hint":"If warning cleanup still looks worthwhile, only adjust plain HTTPS/git fetch URLs, not `gitlab:` flake input shorthands.","failure_detail":"Fetch failed for `gitlab:andypython/object.git/master?host=gitlab.redox-os.org` with `404 Project Not Found`.","learned_scope":"Need to split flake-input URL handling from raw git URL handling; they are not interchangeable."}}
{"run":31,"commit":"9ce18e8","metric":8176,"metrics":{"build_ms":7130,"run_ms":1046,"image_bytes":637534208},"status":"discard","description":"Preferring `/dev/shm` for the VM work dir did not beat the current best; tmpfs staging was effectively a wash for this smoke workload.","timestamp":1776305853261,"segment":4,"confidence":12.717001629549157,"iterationTokens":1738,"asi":{"hypothesis":"Creating the VM work dir on `/dev/shm` when available would shave image-copy and runner I/O overhead without changing semantics.","rollback_reason":"Primary metric regressed slightly from 8112ms to 8176ms on a steady-state runner-only change, so the tmpfs preference is not worth keeping.","next_action_hint":"Leave work-dir placement alone; remaining gains likely need build-graph trimming rather than filesystem staging tweaks.","result":"No benchmark win despite using tmpfs staging.","observed_tradeoff":"build_ms changed only marginally and run_ms actually worsened a bit, so the current disk-backed temp dir is already good enough here."}}
{"run":32,"commit":"14d9857","metric":7891,"metrics":{"build_ms":6853,"run_ms":1037,"image_bytes":637534208},"status":"keep","description":"Keep flake input pruning: removed unused `redox-liner-src` from `flake.nix`/`flake.lock`, which trims steady-state smoke total_ms from 8112 to 7891.","timestamp":1776305993541,"segment":4,"confidence":13.077850877192983,"iterationTokens":4070,"asi":{"hypothesis":"Even unused flake inputs can cost eval/fetch overhead on every benchmark run, so removing the unreferenced `redox-liner-src` input should reduce build_ms.","result":"Improved total_ms to 7891 with build_ms=6853 and unchanged image_bytes.","validation":"Smoke suite still passed 18/18; search confirmed `redox-liner-src` had no code references outside lock/examples before removal.","key_design_choice":"Treat unused flake inputs as benchmark-visible dependency graph bloat and prune them instead of trying to canonicalize their redirecting URLs.","next_action_hint":"Look for other unused or smoke-irrelevant flake inputs/overlay edges that still fetch or evaluate on every run, and prune them carefully."}}
{"run":33,"commit":"14d9857","metric":79912,"metrics":{"build_ms":78895,"run_ms":1016,"image_bytes":637534208},"status":"discard","description":"First raw-git URL canonicalization pass rebuilt large parts of the ion/relibc dependency graph, so the initial benchmark was dominated by one-time package rebuild cost.","timestamp":1776306173923,"segment":4,"confidence":11.220131702728128,"iterationTokens":3674,"asi":{"hypothesis":"Adding `.git` to the raw GitLab fetch URLs for `liner`, `calc`, `small`, and relibc's `object` source will remove redirect overhead on steady-state smoke builds.","rollback_reason":"Primary metric exploded on the first run because changing the source fetch URLs forced a large rebuild, so this pass cannot be judged without a steady-state rerun.","next_action_hint":"Reapply `/tmp/redox-git-url-dotgit.patch` and rerun once; if the second pass beats 7891ms and the redirect warnings drop, keep it.","result":"Smoke suite still passed and run_ms stayed normal, so the regression was build-graph churn rather than runtime breakage.","saved_patch":"/tmp/redox-git-url-dotgit.patch","observed_tradeoff":"Source URL normalization may still help steady state, but its first-run cost is very high."}}
{"run":34,"commit":"14d9857","metric":7966,"metrics":{"build_ms":6953,"run_ms":1012,"image_bytes":637534208},"status":"discard","description":"Steady-state raw-git URL `.git` normalization did not help; redirect warnings were unchanged and total_ms still landed slightly above the current best.","timestamp":1776306212060,"segment":4,"confidence":11.273156899810964,"iterationTokens":1137,"asi":{"hypothesis":"If canonical raw Git URLs mattered, the rerun after one-time rebuild cost would beat 7891ms and reduce the warning spam.","rollback_reason":"Second-pass total_ms was 7966ms, still worse than the best 7891ms, and the same four redirect warnings remained.","next_action_hint":"Drop the URL-canonicalization path entirely; the warnings are not coming from these raw fetch URLs in a way that matters to this benchmark.","result":"No steady-state win; warning source likely lies elsewhere (for example flake inputs or fetcher internals).","observed_tradeoff":"Expensive first-run rebuild plus no warning reduction makes this path stale."}}
{"run":35,"commit":"14d9857","metric":8008,"metrics":{"build_ms":6976,"run_ms":1031,"image_bytes":637534208},"status":"discard","description":"First `tokei-src` top-level input removal rebuilt no smoke artifacts but did pay the one-time flake.lock update cost, leaving the initial run slightly above the current best.","timestamp":1776306349171,"segment":4,"confidence":12.423958333333333,"iterationTokens":7200,"asi":{"hypothesis":"Moving unused-on-benchmark package sources like `tokei-src` out of top-level flake inputs and into package-local fetchers should shrink flake evaluation overhead without affecting the smoke workflow.","rollback_reason":"Primary metric on the first run was still above the best 7891ms, and the run included a one-time lock-file removal update, so it is not enough evidence to keep.","next_action_hint":"Reapply `/tmp/redox-prune-tokei.patch` and rerun once; if steady state drops below 7891ms, keep it and consider the same treatment for similar GitHub-only tool inputs.","saved_patch":"/tmp/redox-prune-tokei.patch","result":"Smoke semantics unchanged; only top-level input plumbing changed.","observed_tradeoff":"The idea is still plausible, but first-run lock maintenance obscures its real steady-state cost."}}
{"run":36,"commit":"ae46ecf","metric":7335,"metrics":{"build_ms":6480,"run_ms":854,"image_bytes":637534208},"status":"keep","description":"Keep `tokei-src` pruning: moved `tokei` to a package-local `fetchFromGitHub` and removed the top-level `tokei-src` flake input, dropping steady-state total_ms from 7891 to 7335.","timestamp":1776306378848,"segment":4,"confidence":13.80862831858407,"iterationTokens":1318,"asi":{"hypothesis":"The first `tokei-src` removal run was lock-update noise; in steady state, shrinking the top-level flake input graph by moving smoke-irrelevant package sources local should reduce build_ms.","result":"Improved total_ms to 7335 with build_ms=6480 and run_ms=854.","validation":"Smoke suite still passed 18/18 with unchanged image size and no smoke-package behavior changes.","key_design_choice":"Keep smoke-irrelevant source fetches out of top-level flake inputs when they are only needed by one package definition.","next_action_hint":"Try the same treatment on the next unrelated top-level GitHub source input such as `lsd-src` or `shellharden-src`; this looks like a real class of wins, not a one-off."}}
{"run":37,"commit":"895a66e","metric":7333,"metrics":{"build_ms":6465,"run_ms":867,"image_bytes":637534208},"status":"keep","description":"Keep `lsd-src` pruning too: moved `lsd` to a package-local `fetchFromGitHub` and removed the top-level `lsd-src` flake input, yielding a small further drop from 7335 to 7333.","timestamp":1776306436472,"segment":4,"confidence":13.682191780821919,"iterationTokens":1524,"asi":{"hypothesis":"The same top-level input pruning that helped `tokei-src` should also help another smoke-irrelevant GitHub package input like `lsd-src`.","result":"Marginally improved total_ms to 7333 with build_ms=6465.","validation":"Smoke suite still passed 18/18; only unrelated package source plumbing changed.","key_design_choice":"Continue shrinking the top-level flake input graph by localizing package-only fetches.","next_action_hint":"Rerun once to see whether this 2ms gain is real or noise, then either keep pruning similar inputs or stop if the class is saturated."}}
{"run":38,"commit":"895a66e","metric":7588,"metrics":{"build_ms":6728,"run_ms":860,"image_bytes":637534208},"status":"discard","description":"Noise check after the `lsd-src` pruning keep: unchanged code reran slower, so the extra 2ms gain is within normal noise even though the broader input-pruning class still looks useful.","timestamp":1776306465849,"segment":4,"confidence":13.555917480998914,"iterationTokens":1405,"asi":{"hypothesis":"Repeat the unchanged `lsd-src`-pruned benchmark once to estimate whether the tiny 2ms win was real.","rollback_reason":"No code changes and worse total_ms than the current best; this rerun only measures noise.","next_action_hint":"Treat `lsd-src` pruning as at best neutral-to-small, and continue only with bigger input-pruning candidates or more structural wins.","observed_noise":"Steady-state rerun moved from 7333ms to 7588ms with no code changes; noise at this scale exceeds the measured 2ms gain.","result":"Useful noise measurement only."}}
