{"run":75,"commit":"3813e84","metric":27131,"metrics":{"build_ms":26113,"run_ms":1017,"image_bytes":637534208},"status":"discard","description":"First smoke-only monolithic-base pass rebuilt the smoke image path heavily, so this run cannot judge steady-state value yet.","timestamp":1776313552803,"segment":7,"confidence":3.5258620689655173,"iterationTokens":1561,"asi":{"hypothesis":"Because `basePerCrate` is the largest remaining smoke-path eval hotspot, overriding only the smoke system to use the monolithic `modularPkgs.system.base` may reduce end-to-end smoke time when base itself is untouched.","rollback_reason":"Primary metric was dominated by first-run rebuild churn (~26s build_ms), so this pass is unusable as keep/discard evidence.","next_action_hint":"Reapply `/tmp/redox-smoke-monolithic-base.patch` and rerun once if you want a steady-state read, but treat any apparent win cautiously because this could overfit away base-edit iteration cost.","saved_patch":"/tmp/redox-smoke-monolithic-base.patch","result":"Smoke suite still passed with unchanged image size, so the smoke workload itself survived the base-package swap.","overfit_risk":"A smoke-only monolithic base could improve the benchmark while making actual base-driver edit loops worse, so it needs extra skepticism even if the rerun wins."}}
{"run":76,"commit":"3813e84","metric":4490,"metrics":{"build_ms":3462,"run_ms":1027,"image_bytes":637534208},"status":"discard","description":"Smoke-only monolithic `base` made the benchmark much faster, but this likely overfits away real base-edit iteration cost by bypassing the per-crate base package only in the smoke profile.","timestamp":1776313604099,"segment":7,"confidence":3.68192048012003,"iterationTokens":1059,"asi":{"hypothesis":"Because `basePerCrate` is the largest remaining smoke-path eval hotspot, overriding only the smoke system to use the monolithic `modularPkgs.system.base` may reduce end-to-end smoke time when base itself is untouched.","rollback_reason":"Despite the large primary-metric win, this change is benchmark-risky: it optimizes the smoke profile by sidestepping per-crate base evaluation and likely makes actual base-source edit loops less representative.","next_action_hint":"If revisiting, first compare monolithic-vs-per-crate smoke runs under an actual base-related source touch; do not keep this shortcut on no-op smoke numbers alone.","saved_patch":"/tmp/redox-smoke-monolithic-base.patch","result":"Steady-state smoke run dropped to total_ms=4490 with build_ms=3462 and unchanged image size.","overfit_risk":"The smoke benchmark benefits when base is untouched, but the dedicated smoke profile should not hide the costs of iterating on Redox base components themselves."}}
{"run":77,"commit":"3813e84","metric":13981,"metrics":{"build_ms":13137,"run_ms":843,"image_bytes":637534208},"status":"discard","description":"First smoke-profile virtio-only hardware pass rebuilt the image path, so this run cannot judge steady-state value yet.","timestamp":1776313802106,"segment":7,"confidence":3.272,"iterationTokens":1535,"asi":{"hypothesis":"Because the smoke runner is Cloud Hypervisor-only and networking is disabled, restricting the smoke profile to `storageDrivers = [ \"virtio-blkd\" ]` and `networkDrivers = [ ]` should remove unnecessary driver copying without changing the workload.","rollback_reason":"Primary metric was dominated by first-run rebuild churn (~13.1s build_ms), so this pass is unusable as keep/discard evidence.","next_action_hint":"Reapply `/tmp/redox-smoke-virtio-only.patch` and rerun once; keep only if the steady-state pass beats both the 6242ms smoke-profile control and the current shared-env tree.","saved_patch":"/tmp/redox-smoke-virtio-only.patch","result":"Smoke suite still passed and run_ms improved, so the candidate preserved current smoke semantics.","control_reference":"run 72 smoke-profile dirty control was 6242ms with build_ms=5188."}}
{"run":78,"commit":"3813e84","metric":14728,"metrics":{"build_ms":13575,"run_ms":1153,"image_bytes":637534208},"status":"discard","description":"First smoke-specific `baseSmokePerCrate` pass rebuilt the smoke image path heavily, so this run cannot judge steady-state value yet.","timestamp":1776314488156,"segment":7,"confidence":2.9799635701275045,"iterationTokens":1535,"asi":{"hypothesis":"If the smoke profile uses a per-crate base package pruned to only the daemons/drivers it actually needs, unit2nix workspace aggregation should shrink without falling back to the benchmark-risky monolithic `base` package.","rollback_reason":"Primary metric was dominated by first-run rebuild churn (~13.6s build_ms), so this pass is unusable as keep/discard evidence.","next_action_hint":"Reapply `/tmp/redox-base-smoke-subset.patch` and rerun once; if the steady-state pass beats the current shared-env tree, this is a stronger candidate than the monolithic-base shortcut.","saved_patch":"/tmp/redox-base-smoke-subset.patch","result":"Smoke suite still passed with unchanged image size, so the subset preserved current smoke semantics on the first run.","overfit_guard":"Unlike the monolithic-base shortcut, this still uses per-crate base builds for the smoke-needed members only; judge it on the second pass, not this rebuild-heavy first run."}}
{"run":79,"commit":"3813e84","metric":6546,"metrics":{"build_ms":5416,"run_ms":1129,"image_bytes":637534208},"status":"discard","description":"Steady-state `baseSmokePerCrate` still lost to the current shared-env tree, so pruning the base unit2nix graph to smoke-needed members is not enough on its own.","timestamp":1776314514043,"segment":7,"confidence":3.272,"iterationTokens":1165,"asi":{"hypothesis":"If the smoke profile uses a per-crate base package pruned to only the daemons/drivers it actually needs, unit2nix workspace aggregation should shrink without falling back to the benchmark-risky monolithic `base` package.","rollback_reason":"Second-pass total_ms 6546 is still above the current observed best 5598, so this direct basePerCrate-pruning attempt is not a win.","next_action_hint":"The remaining basePerCrate cost is likely deeper in unit2nix evaluation than simple workspace-member pruning at the caller. Next step: inspect `../unit2nix/` for ways to prune crate graph construction itself when members are selected.","saved_patch":"/tmp/redox-base-smoke-subset.patch","result":"Smoke suite stayed green with unchanged image size, but the primary metric regressed versus the current tree.","overfit_guard":"This was a more principled version of the monolithic-base shortcut, yet it still failed to beat the current tree."}}
{"run":80,"commit":"3813e84","metric":9719,"metrics":{"build_ms":6842,"run_ms":2876,"image_bytes":637534208},"status":"discard","description":"First vendored unit2nix host-crate pruning pass changed the package-eval path heavily, so this run cannot judge steady-state value yet.","timestamp":1776315096921,"segment":7,"confidence":2.9799635701275045,"iterationTokens":25992,"asi":{"hypothesis":"`build-from-unit-graph.nix` currently constructs a full host crate set even though base's host/build-script closure is tiny (~15 crates vs 229 total). A local patched copy that prunes host buildable crates to the actual build/proc-macro closure should cut eval-heavy smoke builds globally, not just via smoke-profile hacks.","rollback_reason":"Primary metric regressed on the first run, likely from first-pass churn after changing the unit2nix import path and vendoring a local copy, so this pass is unusable as keep/discard evidence.","next_action_hint":"Reapply `/tmp/redox-unit2nix-host-prune.patch` and rerun once; if the steady-state pass beats the current shared-env tree, this is the most credible unit2nix-level candidate so far.","saved_patch":"/tmp/redox-unit2nix-host-prune.patch","result":"Smoke suite still passed with unchanged image size; the first-run regression was in build/eval and runtime noise, not semantics.","unit2nix_signal":"For base-build-plan, measured host closure is only ~15 crates versus 229 total, so pruning host graph construction remains plausible despite this first churn-heavy run."}}
{"run":81,"commit":"3813e84","metric":9013,"metrics":{"build_ms":6143,"run_ms":2869,"image_bytes":637534208},"status":"discard","description":"Steady-state vendored unit2nix host-crate pruning still lost badly to the current tree, so pruning host buildable crates in the local `build-from-unit-graph` copy is not enough as implemented.","timestamp":1776315131578,"segment":7,"confidence":2.580441640378549,"iterationTokens":1210,"asi":{"hypothesis":"If unit2nix only constructs the host/build-script closure actually needed by the selected target graph, smoke builds should speed up because base's host closure is tiny (~15 crates).","rollback_reason":"Second-pass total_ms 9013 is far above the current observed best 5598 and even build_ms stayed worse, so this host-crate-pruning implementation is not a win.","next_action_hint":"Inspect whether vendoring the local unit2nix copy itself added overhead or whether the real hotspot is elsewhere in build-from-unit-graph (for example target crate attrset construction or helper imports).","saved_patch":"/tmp/redox-unit2nix-host-prune.patch","result":"Smoke suite stayed green but both total_ms and build_ms regressed versus the current tree.","unit2nix_signal":"The measured host closure size alone was not enough to produce a benchmark win in this implementation."}}
{"run":82,"commit":"3813e84","metric":8813,"metrics":{"build_ms":6204,"run_ms":2608,"image_bytes":637534208},"status":"discard","description":"Control for vendoring `build-from-unit-graph.nix` locally: simply routing Redox through a local copy of the current upstream unit2nix file already regressed badly, so recent unit2nix-local experiments are confounded by the vendored path itself.","timestamp":1776315224471,"segment":7,"confidence":2.0956447480785654,"iterationTokens":2590,"asi":{"hypothesis":"Before trusting deeper unit2nix-file edits, check whether importing a vendored local copy of the same upstream `build-from-unit-graph.nix` is itself neutral on the smoke benchmark.","rollback_reason":"Even the no-op vendored control regressed sharply, so local-copy unit2nix experiments are not clean evidence for a real product win in Redox.","next_action_hint":"Avoid vendoring `build-from-unit-graph.nix` inside Redox for benchmark experiments. If targeting unit2nix next, either update the actual input cleanly or find Redox-side hotspots that do not depend on a local copy.","saved_patch":"/tmp/redox-unit2nix-vendor-control.patch","result":"Smoke suite still passed, but total_ms=8813/build_ms=6204 showed that the local-copy path itself is costly here.","confounder":"The earlier host-closure-pruning experiment likely mixed its own logic with this vendor-path regression, so do not over-interpret that loss."}}
{"run":83,"commit":"3813e84","metric":9011,"metrics":{"build_ms":6161,"run_ms":2850,"image_bytes":637534208},"status":"discard","description":"Steady-state vendored unit2nix control still regressed badly, confirming that routing Redox through a local copy of `build-from-unit-graph.nix` is itself a bad benchmark path here.","timestamp":1776315328865,"segment":7,"confidence":1.857683573050719,"iterationTokens":3668,"asi":{"hypothesis":"If vendoring the current upstream `build-from-unit-graph.nix` locally were neutral, then deeper unit2nix-local experiments inside Redox would still be trustworthy.","rollback_reason":"Second-pass total_ms 9011 is far above the current observed best 5598, so local-copy unit2nix experiments inside Redox are confounded and not worth pursuing further in this form.","next_action_hint":"Drop in-repo vendored unit2nix experiments. Either update the real unit2nix input cleanly or return to Redox-side hotspots that do not require a local copy of the dependency.","saved_patch":"/tmp/redox-unit2nix-vendor-control.patch","result":"Smoke suite stayed green but build_ms/run_ms remained much worse than the current tree even on the second pass.","confounder":"This means the earlier vendored host-pruning loss cannot be trusted as evidence about the host-closure idea itself."}}
{"run":84,"commit":"3813e84","metric":12483,"metrics":{"build_ms":10834,"run_ms":1648,"image_bytes":637534208},"status":"discard","description":"Base-touch control for the current per-crate smoke path: bumping `base-src-patched`'s derivation name forces the base package path to change, approximating a real base-related edit without semantic drift.","timestamp":1776315479178,"segment":7,"confidence":1.8097345132743363,"iterationTokens":455,"asi":{"hypothesis":"Before trusting the smoke-only monolithic `base` shortcut, compare it against the current tree under an actual base-package rebuild trigger rather than a no-op smoke rerun.","rollback_reason":"Control run only; no product improvement intended.","next_action_hint":"Apply the same base-touch trigger together with the smoke-only monolithic `base` override and compare against this 12483ms control.","result":"Per-crate base-touch control landed at total_ms=12483 with build_ms=10834.","control_use":"Use as base-edit-like reference for monolithic-base overfit validation."}}
{"run":85,"commit":"3813e84","metric":27277,"metrics":{"build_ms":25950,"run_ms":1326,"image_bytes":637534208},"status":"discard","description":"Base-touch validation killed the smoke-only monolithic `base` shortcut: under the same forced base-package rebuild trigger, the monolithic smoke path was far slower than the current per-crate control.","timestamp":1776315539748,"segment":7,"confidence":1.7245256500351371,"iterationTokens":1136,"asi":{"hypothesis":"If the smoke-only monolithic `base` shortcut were a real product win instead of benchmark overfit, it should stay competitive when the base package itself changes.","rollback_reason":"Under the same base-touch trigger, the monolithic smoke path ballooned to 27277ms versus the current per-crate control at 12483ms, confirming it hides real base-edit iteration cost.","next_action_hint":"Retire the monolithic-base idea from the backlog. Future work should target real unit2nix/basePerCrate costs without bypassing them in the smoke profile.","result":"Monolithic-base + base-touch landed at total_ms=27277 with build_ms=25950.","control_reference":"run 84 per-crate base-touch control was total_ms=12483 with build_ms=10834.","validation":"This was the same non-semantic base-package rebuild trigger (patchedSrc name bump) on both paths, so the comparison isolates the smoke-only base-package choice."}}
{"run":86,"commit":"3813e84","metric":6621,"metrics":{"build_ms":5751,"run_ms":869,"image_bytes":637534208},"status":"discard","description":"Control for benchmarking the real local unit2nix input path: overriding Redox to the current `../unit2nix` HEAD (without extra changes) is somewhat slower than the locked input, so future upstream-style experiments must compare against this override baseline, not against the locked upstream input.","timestamp":1776315994022,"segment":7,"confidence":1.8097345132743363,"iterationTokens":12364,"asi":{"hypothesis":"Before changing `../unit2nix`, measure the cost of using the real local unit2nix repo through `--override-input` so upstream experiments are compared fairly.","rollback_reason":"Control run only; no product improvement intended.","next_action_hint":"Patch `../unit2nix` directly and compare against this 6621ms real-input control, not the 5598ms locked-input best.","result":"Real-input control with current `../unit2nix` HEAD landed at total_ms=6621 with build_ms=5751.","control_use":"Use as baseline for experiments that change the actual `../unit2nix` repo and benchmark via `UNIT2NIX_INPUT=git+file:///...`."}}
{"run":87,"commit":"3813e84","metric":6652,"metrics":{"build_ms":5649,"run_ms":1002,"image_bytes":637534208},"status":"discard","description":"First real-input unit2nix host/member-closure pruning pass was essentially flat versus the local-input control, so it needs a steady-state rerun before judgment.","timestamp":1776316085217,"segment":7,"confidence":1.857683573050719,"iterationTokens":3799,"asi":{"hypothesis":"Pruning `build-from-unit-graph.nix` to only the selected target closure plus actual host/build-script closure should reduce unit2nix eval work for large plans like Redox base when benchmarked through the real unit2nix input path.","rollback_reason":"First pass landed basically on top of the local-unit2nix control, so this single result is not enough evidence to keep or upstream.","next_action_hint":"Rerun the same committed `../unit2nix` change against the same `UNIT2NIX_INPUT=git+file:///...` path; only treat it as real if the second pass clearly beats the 6621ms local-input control.","result":"Real-input patched unit2nix run landed at total_ms=6652 with build_ms=5649.","control_reference":"run 86 local unit2nix input control was total_ms=6621 with build_ms=5751."}}
{"run":88,"commit":"3813e84","metric":6833,"metrics":{"build_ms":5772,"run_ms":1060,"image_bytes":637534208},"status":"discard","description":"Steady-state real-input unit2nix host/member-closure pruning still lost to the local-input control, so this upstream candidate is not worth pursuing as implemented.","timestamp":1776316105762,"segment":7,"confidence":2.0956447480785654,"iterationTokens":961,"asi":{"hypothesis":"If `build-from-unit-graph.nix` only constructed the selected target closure plus the actual host/build-script closure, the real unit2nix input path should beat the 6621ms local-input control.","rollback_reason":"Second-pass total_ms 6833 is worse than the 6621ms local-input control, so this specific upstream pruning patch is not a win.","next_action_hint":"Reset `../unit2nix` off this commit and look for a different upstream lever, or move back to Redox-side hotspots that do not depend on this unit2nix shape.","result":"Second patched-unit2nix run landed at total_ms=6833 with build_ms=5772.","control_reference":"run 86 local unit2nix input control was total_ms=6621 with build_ms=5751."}}
{"run":89,"commit":"3813e84","metric":7438,"metrics":{"build_ms":6347,"run_ms":1090,"image_bytes":637534208},"status":"discard","description":"Comment-only dirty control for `nix/redox-system/lib/make-disk-image.nix` to establish the current same-file benchmark floor before testing larger-block final partition writes.","timestamp":1776316620591,"segment":7,"confidence":2.1265164644714036,"iterationTokens":961,"asi":{"hypothesis":"A same-file dirty control on `make-disk-image.nix` is needed before judging any final GPT assembly tweak in that file.","rollback_reason":"Control run only; no product improvement intended.","next_action_hint":"Apply the larger-block `dd` write change in `make-disk-image.nix` and compare against this 7438ms same-file dirty control.","result":"Comment-only make-disk-image control landed at total_ms=7438 with build_ms=6347.","control_use":"Use as immediate control for `make-disk-image.nix` write-granularity experiments."}}
{"run":90,"commit":"3813e84","metric":12062,"metrics":{"build_ms":11017,"run_ms":1044,"image_bytes":637534208},"status":"discard","description":"Larger-block final partition writes in `make-disk-image.nix` regressed badly; switching the final `dd` splices from 512-byte sectors to 1MiB writes blew the smoke benchmark up instead of helping.","timestamp":1776316657899,"segment":7,"confidence":1.983030303030303,"iterationTokens":1145,"asi":{"hypothesis":"Because both partition payloads start on MiB boundaries, writing them into `disk.img` with `dd bs=1M` might cut host-side syscall overhead versus the current sector-sized writes.","rollback_reason":"The candidate regressed hard: total_ms 12062 and build_ms 11017 versus the same-file comment-only control at 7438 / 6347.","next_action_hint":"Do not pursue the larger-block final `dd` splice idea further; move on to a different disk-image or runner-side lever.","result":"`make-disk-image.nix` with `dd bs=1M` for both partition writes landed at total_ms=12062 with build_ms=11017.","control_reference":"run 89 comment-only `make-disk-image.nix` control was total_ms=7438 with build_ms=6347."}}
{"run":91,"commit":"3813e84","metric":0,"metrics":{"build_ms":0,"run_ms":0,"image_bytes":0},"status":"crash","description":"Read-only smoke disk experiment failed at boot: Cloud Hypervisor rejected a guest block write on the raw image (`Request check failed ... ReadOnly`), so the smoke image does require writable disk semantics during early boot.","timestamp":1776316846492,"segment":7,"confidence":1.983030303030303,"iterationTokens":11185,"asi":{"hypothesis":"If the smoke runner could boot directly from the store image with `readonly=on`, it could skip the per-run raw-image copy in `mk-vm-test.nix` and shave run_ms without changing guest semantics.","rollback_reason":"Boot failed immediately because the guest attempted a disk write against the read-only virtio-blk device.","next_action_hint":"Do not pursue read-only raw-disk boot for the smoke runner unless Redox can boot with a writable overlay or otherwise avoid early rootfs writes.","error_detail":"Cloud Hypervisor logged `Request check failed ... ReadOnly` for an `Out` request during boot."}}
